tweet id,time of tweet,user id,text
1634026575329914881,2023-03-10 03:01:08+00:00,https://twitter.com/farukturk,Fed global bir krizi tetiklemeye başladı FederalReserve global krizi erken getirecek gibi SVB bankasının değer kaybı⬇️ Bitcoin BTC ETH Crypto altcoin borsa kripto altın ORN Rose Alpine bist Bist Ethereum dolar quick kriptoparalar cryptocurrency
1634026418676924420,2023-03-10 03:00:31+00:00,https://twitter.com/TodaysCryptoCom,The Truth About Crypto httpstcoCkyyZ AICrypto cryptocurrency bitcoin blockchain btc crypto ethereum ico trading altcoin airdrop
1634019819233370112,2023-03-10 02:34:18+00:00,https://twitter.com/NewsFTCrypto,Shiba Inu SHIB Ecosystem Altcoin Adds New Crypto Exchange Outperforms Bitcoin and Ethereum httpstcoFKHpQhegFQ
1634018772909723656,2023-03-10 02:30:08+00:00,https://twitter.com/Crypt0Rationale,You can find all the Crypto gems you want but without and Game Plan youre just riding roller coaster Dont give that Altcoin Bull Shit you have scale out Create plan and Execute Altcoins Ethereum Kaspa Bitcoin BTC ETH
1634018712335560704,2023-03-10 02:29:54+00:00,https://twitter.com/CoinAquarium,ChatGPT Takes Stage Discords NextLevel Platform Enhancement Crypto CryptoNews cryptocurrency Web DeFi NFTs NFTCommunity Ethereum altcoin altcoins BTC ETH Metaverse OpenAI OpenAIChatGPT httpstcoIeotoczwz
1634017774153482240,2023-03-10 02:26:10+00:00,https://twitter.com/cryptocook_io,antiendorse these projects Buterins shitcoin war sees him sent another httpstcoKsuThSxyCW Ethereum Airdrop Altcoin Developers Ethereum Reddit ShibaInu Taxreduction Taxes VitalikButerin
1634016250459455488,2023-03-10 02:20:07+00:00,https://twitter.com/TheDripStar,Massacre Altcoin House Ethereum ETH and Different DeFiLinked Altcoins Are Crashing Cryptocurrency Sponsor httpstcomPhKtNCN httpstcofHQVUYEIr
1634014518115450882,2023-03-10 02:13:14+00:00,https://twitter.com/comobik,fact extremely dangerous invest altcoin except Bitcoin Ethereum time when there are proper regulations yet Nevertheless you have your mind set think important watch the companys performance instead the price Watch ankr
1634010584730550273,2023-03-10 01:57:36+00:00,https://twitter.com/p2p_metaverse,Aptos APT Trade Expecting this the best trade out all the altcoin MAJORS Decided share one our altcoin trades cryptocurrencies cryptocurrency bitcoin crypto blockchain ethereum btc cryptotrading cryptonews bitcoinnews bitcoins cryptotrader httpstcobkqUNedkB
1634010323672875009,2023-03-10 01:56:34+00:00,https://twitter.com/news_revive,Shiba Inu SHIB Ecosystem Altcoin Adds New Crypto Exchange Outperforms Bitcoin and Ethereum httpstcoLluIgLx
1634007522402250752,2023-03-10 01:45:26+00:00,https://twitter.com/prominentcrypt0,Shiba Inu SHIB Ecosystem Altcoin Adds New Crypto Exchange Outperforms Bitcoin and Ethereum httpstcoSXVGppRcyi ProminentCrypto Blockchain Web Altcoin
1633999828920279041,2023-03-10 01:14:52+00:00,https://twitter.com/audiovideofan,crypto cryptonews socialmedia SocialNetwork bitcoinnews blockchain dexacoin cryptolife cryptoworld fintech btc ethereum altcoin trading
1633999495665967104,2023-03-10 01:13:32+00:00,https://twitter.com/URECOMM,Shiba Inu SHIB Ecosystem Altcoin Adds New Crypto Exchange Outperforms Bitcoin and Ethereum httpstcoJdidrXMIr
1633999180283670529,2023-03-10 01:12:17+00:00,https://twitter.com/KriptoZZcom,Ethereum Kurucusu Vitalik Buterin’den Uyarı kriptopara haber Sondakika Bist Binance DOGE SHIBA Paribu Bitci Bitcoin BinanceTR Haber Finans Dolar Euro altcoin MATIC borsa Aptos Merkez Bankası SONDAKIKA SON DAKIKA httpstcoOgiLVep
1633999172251656192,2023-03-10 01:12:15+00:00,https://twitter.com/0xEthereumYoda,Ethereum price update ETH USD Bitcoin BTC Follow for recent ETH price updates altcoin cryptocurrency crypto
1633996214919151617,2023-03-10 01:00:30+00:00,https://twitter.com/BTCLaraCroft,Ethereum has been fire lately crypto altcoin
1633994544529256448,2023-03-10 00:53:52+00:00,https://twitter.com/YehudiGuy5,Ethereum price update ETH USDBitcoin BTCFollow for recent ETH price updatesaltcoin cryptocurrency crypto
1633994481279303680,2023-03-10 00:53:37+00:00,https://twitter.com/DropTownSaloon,Digital Real Pilot Run EthereumCompatible Permissioned Blockchain Finance Bitcoin News httpstcogmjbwE Crypto CryptoNews CryptoTrends NFT NFTNews NFTRelease NFTDrop AltCoin AirDrop NFTProject NFTArtist NFTCommunity CNFT CNFTCommunnity httpstcoOjdxzZI
1633992331719331840,2023-03-10 00:45:04+00:00,https://twitter.com/FranzXRP,Welcome the party ethereum and all altcoin fans 😅😅😅
1633989191406329856,2023-03-10 00:32:35+00:00,https://twitter.com/CryptoTraderPro,THE DAILY HODL Shiba Inu SHIB Ecosystem Altcoin Adds New Crypto Exchange Outperforms Bitcoin and Ethereum httpstcokBQlLDVO httpstcoClqIfPUHDc
1633988711946887169,2023-03-10 00:30:41+00:00,https://twitter.com/Elvismanyika,Shiba Inu SHIB Ecosystem Altcoin Adds New Crypto Exchange Outperforms Bitcoin and Ethereum httpstcocbEnhcfZt
1633987096972230657,2023-03-10 00:24:16+00:00,https://twitter.com/AltcoinDailyio,JUST New York Attorney General Alleges Ethereum Security KuCoin Lawsuit
1633986287085690880,2023-03-10 00:21:03+00:00,https://twitter.com/nowtesdefi,Shiba Inu SHIB Ecosystem Altcoin Adds New Crypto Exchange Outperforms Bitcoin and Ethereum httpstcojlttQqCJ
1633985955937013760,2023-03-10 00:19:44+00:00,https://twitter.com/DropTownSaloon,Will Ethereum Classic repeat recent history and recover from level soon httpstcoskttEJfD Crypto CryptoNews CryptoTrends NFT NFTNews NFTRelease NFTDrop AltCoin AirDrop NFTProject NFTArtist NFTCommunity CNFT CNFTCommunnity httpstcomoHIglpmmy
1633984398747119616,2023-03-10 00:13:33+00:00,https://twitter.com/read_xkrip,Crypto bleeding has most altcoins buying zone Santiment httpstcoqVSOywKhQ altcoin bitcoin cryptotrader ethereum
1633984377020628992,2023-03-10 00:13:28+00:00,https://twitter.com/CryptoWorldVsn,Shiba Inu SHIB Ecosystem Altcoin Adds New Crypto Exchange Outperforms Bitcoin and Ethereum httpstcoJqCDBdz
1633981643974164480,2023-03-10 00:02:36+00:00,https://twitter.com/huntermonkey_,Cezayirden iyi akşamlar Cezayirde bulunduğum için çok aktif olamıyorum Düşüş fud haberleri ile beklediğimden daha fazla derinleşti ETH için grafikteki yapıyı takip edeceğim civarından sonra net satıcı olacağım Ethereum kripto altcoin httpstcoWoEIUZRGKo
1633981258949615616,2023-03-10 00:01:04+00:00,https://twitter.com/cryptowise_fin,Trending Ethereum News Shiba Inu SHIB Ecosystem Altcoin Adds New Crypto Exchange Outperforms Bitcoin and Ethereum cryptonews crypto cryptocurrency ETH ETH Follow for more httpstcowHpebLEHcq
1633981093920555008,2023-03-10 00:00:25+00:00,https://twitter.com/runbibot,ALERT ATOM has entered Bullish territory crypto altcoin defi NFT Bitcoin Ethereum httpstcocFMVrJuP
1633981073075101698,2023-03-10 00:00:20+00:00,https://twitter.com/cryptowise_fin,Trending Bitcoin News Shiba Inu SHIB Ecosystem Altcoin Adds New Crypto Exchange Outperforms Bitcoin and Ethereum cryptonews crypto cryptocurrency BTC BTC Follow for more httpstcoaJVPRvyvQG
1633980403810705409,2023-03-09 23:57:40+00:00,https://twitter.com/PavelNosok,Shiba Inu SHIB Ecosystem Altcoin Adds New Crypto Exchange Outperforms Bitcoin and Ethereum httpstcogptaqAnvcy
1633976648046374912,2023-03-09 23:42:45+00:00,https://twitter.com/0xEthereumYoda,Ethereum price update ETH USD Bitcoin BTC Follow for recent ETH price updates altcoin cryptocurrency crypto
1633974585652809729,2023-03-09 23:34:33+00:00,https://twitter.com/roccodallas,Will Ethereum Classic repeat recent history and recover from level soon httpstcoUmzmquglqU Altcoin Analysis HideCryptopanic News httpstcohOzOpmgL
1633972442451550208,2023-03-09 23:26:02+00:00,https://twitter.com/pompcoin,Top Crypto Whales Keep Firm Grip Ethereum ETH While Accumulating One Top Altcoin Analytics Firm The Daily Hodl httpstcoKZIvdYVC
1633971558480748544,2023-03-09 23:22:31+00:00,https://twitter.com/0xEthereumYoda,Ethereum price update ETH USD Bitcoin BTC Follow for recent ETH price updates altcoin cryptocurrency crypto
1633970792227647488,2023-03-09 23:19:29+00:00,https://twitter.com/archibald953609,Ethereum price update ETH USDBitcoin BTCFollow for recent ETH price updatesaltcoin cryptocurrency crypto
1633970274122039297,2023-03-09 23:17:25+00:00,https://twitter.com/cryptorosetta,THIS MUST WATCH VIDEO Smash the like share and retweet please httpstcoEOdozfjc Lido Crypto lidodao CryptocurrencyNews cryptocurrencies cryptocurrency Gaming Cryptocurency Bitcoin BTC ETH Ethereum altcoingem crypto thorchain ALCHEMY altcoin… httpstcogVElgZwb
1633969821112049664,2023-03-09 23:15:37+00:00,https://twitter.com/CryptoNewsBit,Shiba Inu SHIB Ecosystem Altcoin Adds New Crypto Exchange Outperforms Bitcoin and Ethereum Cryptonews Bitcoin Binance nft nftart httpstcowXMeZne
1633969693747814401,2023-03-09 23:15:07+00:00,https://twitter.com/cryptorosetta,THIS MUST WATCH VIDEO Smash the like share and retweet please httpstcoGNzCrTL Lido Crypto lidodao CryptocurrencyNews cryptocurrencies cryptocurrency Gaming Cryptocurency Bitcoin BTC ETH Ethereum altcoingem crypto thorchain THOR altcoin httpstcoxFYWOZH
1633968837572845568,2023-03-09 23:11:43+00:00,https://twitter.com/cryptorosetta,THIS MUST WATCH VIDEO Smash the like share and retweet please httpstcoBmsLJnEHE TRON Crypto CryptocurrencyNews cryptocurrencies cryptocurrency Gaming Cryptocurency Bitcoin BTC ETH Ethereum bitcoinprice altcoingem crypto thorchain THOR altcoin httpstcoOhHMwFbIwx
1633966186340704259,2023-03-09 23:01:11+00:00,https://twitter.com/cryptoalerted,Fun zone FNZ went percent the last minutes httpstcorgEAVgIXu FNZ crypto bitcoin cryptocurrency btc ethereum blockchain eth trading altcoin binance cryptonews
1633964428528853002,2023-03-09 22:54:12+00:00,https://twitter.com/muratacar0990,add lot PRIMAL from here BTC ETH bitcoin Ethereum altcoin metiverse web gaming nft DeFi Crypto AVAX TRX SOL PlayEarn shiba DOGE lunc luna gem apt APT aptos httpstcoxPvqEpp
1633960656662659078,2023-03-09 22:39:12+00:00,https://twitter.com/BNB_Tracker,BinanceCoin price update BNB BNB USD Bitcoin BTC Ethereum ETH altcoin crypto cryptocurrency Follow for recent BNB price updates
1633959860781080579,2023-03-09 22:36:02+00:00,https://twitter.com/CryptoRedivex,Ethereum Declared Commodity SECs Worst Week EVER MetaLawMan httpstcoESVBZIPhd bitcoin cryptocurrency altcoin
1633959635953516545,2023-03-09 22:35:09+00:00,https://twitter.com/BNB_Tracker,BinanceCoin price update BNB BNB USD Bitcoin BTC Ethereum ETH altcoin crypto cryptocurrency Follow for recent BNB price updates
1633956804336971776,2023-03-09 22:23:54+00:00,https://twitter.com/0xEthereumYoda,Ethereum price update ETH USD Bitcoin BTC Follow for recent ETH price updates altcoin cryptocurrency crypto
1633955464533639170,2023-03-09 22:18:34+00:00,https://twitter.com/altcoin2go,Der größte Fehler den ein Land machen kann ist der Angriff auf Bitcoin oder Ethereum Die USRegierung hat sich gerade entschieden heute BEIDES tun Der große Verlierer werden hier die USA sein nicht die Protokolle BTC ETH
1633955266361458688,2023-03-09 22:17:47+00:00,https://twitter.com/DropTownSaloon,New York Attorney General Files Lawsuit Against Kucoin and Declares Ethereum Security Bitcoin News httpstcokUOEOQgj Crypto CryptoNews CryptoTrends NFT NFTNews NFTRelease NFTDrop AltCoin AirDrop NFTProject NFTArtist NFTCommunity CNFT CNFTComm httpstcogOjJrEnGr
1633954310059876356,2023-03-09 22:13:59+00:00,https://twitter.com/altcoin2go,NYAG behauptet Ethereum sei ein Wertpapier KucoinKlage
1633950985788837890,2023-03-09 22:00:47+00:00,https://twitter.com/nuworldcrypto,New York Alleges ETH Security KuCoin Lawsuit cryptocurrency altcoin Ethereum NFTCommunity NFT crypto KuCoin NYAG CryptoNews httpstcoqtlQrjjR
1633948306941558785,2023-03-09 21:50:08+00:00,https://twitter.com/Crypt0Rationale,Let tell you something The Altcoin market will enter the depths hell Bitcoin BTC Ethereum ETH altcoins Crypto
1633948190784233475,2023-03-09 21:49:40+00:00,https://twitter.com/wkimcnl,NEWS httpstcoQqOfDmhdT crypto bitcoin cryptocurrency btc ethereum blockchain eth currency xrp trading price exchange ltc altcoin ico ripple altcoins binance market ada cardano mining cryptonews sol matic polygon shib doge
1633946190806142976,2023-03-09 21:41:43+00:00,https://twitter.com/DropTownSaloon,Die For The Bulls Ethereum ETH Price Tests DMA Support httpstcoRPgTkiq Crypto CryptoNews CryptoTrends NFT NFTNews NFTRelease NFTDrop AltCoin AirDrop NFTProject NFTArtist NFTCommunity CNFT CNFTCommunnity httpstcoEDtZDJZjRE
1633945921636409346,2023-03-09 21:40:39+00:00,https://twitter.com/noel_caba,ETH Actualización Sinceramente esperaba solo día alcanzáramos target marcado Ahora mismo veo señales alcistas cortos pero bajistas temporalidades mayores Puede que rebote para continuar con caída ETH Ethereum altcoin Crypto trading USDT httpstcocYnSQQAGbx
1633945341459300358,2023-03-09 21:38:21+00:00,https://twitter.com/0xEthereumYoda,Ethereum price update ETH USD Bitcoin BTC Follow for recent ETH price updates altcoin cryptocurrency crypto
1633944751811760128,2023-03-09 21:36:00+00:00,https://twitter.com/ImJawed2,Cryptocurency bitcoin Crashing MUFC UEL cryptocurrency cryptonews cryptotrading bitcoin bitcoinnews Ethereum phaverapp ETH Shib lunc LUNC Bitcoin BTCUSDT altcoin cryptocurrency crypto SolanaNFTs SolanaCommunity Sol httpstcocKOwwXmq
1633944351859707905,2023-03-09 21:34:25+00:00,https://twitter.com/ImJawed2,Cryptocurency bitcoin Crashing cryptocurrency cryptonews cryptotrading bitcoin bitcoinnews Ethereum phaverapp ETH Shib lunc LUNC Bitcoin BTCUSDT altcoin cryptocurrency crypto SolanaNFTs SolanaCommunity Aptos Binance httpstcoyBvXwQTKNV
1633943365543776257,2023-03-09 21:30:30+00:00,https://twitter.com/eSIMunlock_com,TMobile Blacklist IMEI Removal amp Repair Unbarring httpstcohdXG years WBC snow FortniteMEGA sneachta Web BTC Bitcoin Ethereum AltCoin CPI Data OpenAI ChatGPT NBA MLB Yankees NFT NFTs NCTDREAM Tank Ryan Garcia Suboxone httpstcopbDtqiwY
1633942767092080642,2023-03-09 21:28:07+00:00,https://twitter.com/kriptoordnrys,Ben buraları alım fırsatı olarak görüyorum Dipten portfoyüme altcoin eklemeleri yapıyorum kda pros chess uft daha birçok coine ekleme yaptım Nakiti olanlar alım fırsatı olarak değerlendirebilir Risk almadan para kazanılmaz 🚀🔥💪 Bitcoin Ethereum Binance
1633942377823100928,2023-03-09 21:26:34+00:00,https://twitter.com/ImJawed2,crypto market crashing slowly from last hours Ethereum Ach Ach Zill BNB XRP TRX ETH Shib lunc LUNC Bitcoin BTCUSDT altcoin cryptocurrency crypto SolanaNFTs SolanaCommunity Aptos Binance cryptocurrencies MUFC UEL
1633941908480462848,2023-03-09 21:24:42+00:00,https://twitter.com/LepikInfo,Finally Time Buy Altcoins Altcoin ethereum via httpstcodtOmVMhZ httpstcojDqOWmg
1633941878176636928,2023-03-09 21:24:35+00:00,https://twitter.com/DropTownSaloon,KuCoin Exchange Sued NYAG Claims Ethereum Security httpstcoXLAzdXGei Crypto CryptoNews CryptoTrends NFT NFTNews NFTRelease NFTDrop AltCoin AirDrop NFTProject NFTArtist NFTCommunity CNFT CNFTCommunnity
1633940555171520512,2023-03-09 21:19:20+00:00,https://twitter.com/wkimcnl,NEWS httpstcoAFAdVmcQ crypto bitcoin cryptocurrency btc ethereum blockchain eth currency xrp trading price exchange ltc altcoin ico ripple altcoins binance market ada cardano mining cryptonews sol matic polygon shib doge
1633939651609366528,2023-03-09 21:15:44+00:00,https://twitter.com/anasri_shoaib,Crypto market crashing Ethereum Ach Ach Zill BNB XRP TRX ETH Shib lunc LUNC Bitcoin BTCUSDT altcoin cryptocurrency crypto SolanaNFTs SolanaCommunity Aptos Binance cryptocurrencies phaverapp
1633938821707628544,2023-03-09 21:12:26+00:00,https://twitter.com/ImJawed2,Feeling pain cryptocurrency cryptonews cryptotrading bitcoin bitcoinnews Ethereum phaverapp ETH Shib lunc LUNC Bitcoin BTCUSDT altcoin cryptocurrency crypto SolanaNFTs SolanaCommunity Aptos Binance cryptocurrencies httpstcoeCTdZAdKw
1633938562197647360,2023-03-09 21:11:24+00:00,https://twitter.com/mrayaan6372,Crashing whole crypto market its feel bad 🥺🥺🥺cryptocurrency cryptonews cryptotrading bitcoin bitcoinnews Ethereum ETH Shib lunc LUNC Bitcoin BTCUSDT altcoin cryptocurrency crypto SolanaNFTs SolanaCommunity Aptos Binance
1633937142161260546,2023-03-09 21:05:46+00:00,https://twitter.com/Matematikci84,şubatta belirttiğim Bölgeye geldiBana göre uzun vade alım bölgesidir Altına sarkarsa yeni bölgeyi belirtirim btc bitcoin eth ada altcoin BTCUSDT eos SHIB Dogecoin CEEK SOL AVAXUSDT AVAX MATIC chz mana gala DOGE total eth Ethereum binance BNB
1633936743173857282,2023-03-09 21:04:11+00:00,https://twitter.com/MaximilianShare,NOTIZIE CRYPTO Cointelegraph Italia Seguimi per News Crypto sempre aggiornate crypto bitcoin cryptocurrency blockchain btc ethereum trading altcoin criptovalute eth cryptotrading blockchain bitcoinprice cryptovalute httpstcoaHnDmuPx
1633935802601226240,2023-03-09 21:00:27+00:00,https://twitter.com/runbibot,ALERT GRT has broken Support crypto altcoin defi NFT Bitcoin Ethereum httpstcoFqvLoqVVJI
1633935798905995265,2023-03-09 21:00:26+00:00,https://twitter.com/runbibot,ALERT XRP has broken Support crypto altcoin defi NFT Bitcoin Ethereum httpstcoZbSETGN
1633935690953023488,2023-03-09 21:00:00+00:00,https://twitter.com/CoinCoinClan,DAILY MARKET RECAP total marketcap altcoin marketcap bitcoin dominance ethereum dominance total volume last DeFi volume last cryptotrading
1633935098088415234,2023-03-09 20:57:39+00:00,https://twitter.com/ImJawed2,crypto market crashing slowly from last hours Ethereum Ach Ach Zill BNB XRP TRX ETH Shib lunc LUNC Bitcoin BTCUSDT altcoin cryptocurrency crypto SolanaNFTs SolanaCommunity Aptos Binance cryptocurrencies
1633935044858224649,2023-03-09 20:57:26+00:00,https://twitter.com/NTETATcrypto,Bitcoin hang tight for the weekend dont forget stoploss bad news still coming from Metaverse NFT PlayEarn altcoin DEFI DeFiChain Crypto NFTCommunity NFTdrop SOL GameFi Ethereum
1633931707727613953,2023-03-09 20:44:10+00:00,https://twitter.com/Wong_insight,Why Ethereum ETH price down today Ethereum price down today and growing list macroeconomic challenges could continue weigh ETH price for the foreseeable future Bitcoin Altcoin httpstcoYhVcyrRa
1633931535190564866,2023-03-09 20:43:29+00:00,https://twitter.com/bagtothefuture_,🚨Bitcoin Price Prediction httpstcoOAjDNhWvyH ethereum investing tech blockchain bullmarket cryptocurrency nft blockchaintechnology CryptoTwitter blockchain trading altcoin bitcoinprice bitcoin btc btc cardano ada sol cryptomarket viral
1633930602196893698,2023-03-09 20:39:47+00:00,https://twitter.com/para_dunyasitr,New York düzenleyicileri kripto para borsası KuCoine dava açtı Kaynak Bloomberg New York Eyalet Başsavcısı Ethereum Luna USTyi Kucoin davasında menkul kıymetler olarak ele aldı btc avax altcoin kucoin
1633928739603230720,2023-03-09 20:32:23+00:00,https://twitter.com/etherfuse,CoinDesk ethereum VitalikButerin Immortal Altcoin kinda dope band name though
1633925465420201984,2023-03-09 20:19:22+00:00,https://twitter.com/CryptoOnchain,ٍETH breaking down the Support Level ETH Ethereum Cryptocurency Cryptos cryptocurrencies altcoin altcoins BTC Bitcoin BNB Binance httpstcoJSzfsVXv
1633925076411383809,2023-03-09 20:17:49+00:00,https://twitter.com/cryptoalerted,LemoChain LEMO went percent the last minutes httpstcorgEAVhgN LEMO crypto bitcoin cryptocurrency btc ethereum blockchain eth trading altcoin binance cryptonews
1633923522073595904,2023-03-09 20:11:39+00:00,https://twitter.com/DropTownSaloon,What Ethereums latest deployment means for ETH and its roadmap httpstcoIpeXpiVe Crypto CryptoNews CryptoTrends NFT NFTNews NFTRelease NFTDrop AltCoin AirDrop NFTProject NFTArtist NFTCommunity CNFT CNFTCommunnity httpstcovzrIGGis
1633922411522400257,2023-03-09 20:07:14+00:00,https://twitter.com/0xEthereumYoda,Ethereum price update ETH USD Bitcoin BTC Follow for recent ETH price updates altcoin cryptocurrency crypto
1633921866841702404,2023-03-09 20:05:04+00:00,https://twitter.com/PaulinusChukw16,hrReason work 🈯️📊 crypto bitcoin cryptocurrency btc ethereum blockchain eth currency xrp trading price exchange ltc altcoin ico ripple altcoins binance market love armenia mining cryptonews change business game news httpstcoyGdzvRgpD
1633920717166182404,2023-03-09 20:00:30+00:00,https://twitter.com/runbibot,ALERT MATIC has broken Support crypto altcoin defi NFT Bitcoin Ethereum httpstcojylLsO
1633920689416675328,2023-03-09 20:00:23+00:00,https://twitter.com/runbibot,ALERT XRP has entered Bearish territory crypto altcoin defi NFT Bitcoin Ethereum httpstcoVuFwNuMYP
1633920633884102656,2023-03-09 20:00:10+00:00,https://twitter.com/runbibot,ALERT SHIB has broken Support crypto altcoin defi NFT Bitcoin Ethereum httpstcoCvJvXVCqM
1633920412269805568,2023-03-09 19:59:17+00:00,https://twitter.com/sidney660330,Ethereum price update ETH USDBitcoin BTCFollow for recent ETH price updatesaltcoin cryptocurrency crypto
1633919768813088768,2023-03-09 19:56:44+00:00,https://twitter.com/ferht123456789,Abd kontrolündeki btc nin çoğu borsalara transfer edildi dün belirttim çok fazla btc transferleri oldu bakalım olacak bıktık bıktık BTC altcoin Ethereum kripto
1633919526315376641,2023-03-09 19:55:46+00:00,https://twitter.com/cryptocook_io,Why Ethereum ETH price down today httpstcoGCPlKjrm Altcoin Altcoin BitcoinPrice Cryptocurrencies CryptocurrencyExchange DecentralizedExchange EtherPrice Ethereum EthereumPrice Markets
1633919239538049028,2023-03-09 19:54:38+00:00,https://twitter.com/ibrahimklczb,Aydır boğa diyenlere cümle bırakın Ben başlıyorum Bitcoin ayda verdiğini günde alır Btc kriptopara altcoin ethereum eth
1633918388094337026,2023-03-09 19:51:15+00:00,https://twitter.com/NoFomoNoCry,telegram market makerdan aldığım haberi paylaştım aradan çok geçmeden bütün dünyanın bahsettiği seviyesi kırıldı fomo yapmayın takip edin bitcoin btc btcusdt eth ethereum ethusdt altcoin cryptocurrency kriptopara buy sell long short futures scalp httpstcoROCWhMjVkU
1633916958910582786,2023-03-09 19:45:34+00:00,https://twitter.com/FAB_coin,Join httpstcoqQvQMWIw learn how you can receive passive income crypto cryptotrading cryptoworld ethereum blockchain blockchaintechnology fintech FABcoin Exchangily⁠ biswap HODL altcoin cryptocurrency digitalcurrency cryptoinvestor decentralize nft httpstcoaHdGEf
1633916938735980544,2023-03-09 19:45:29+00:00,https://twitter.com/NewlyTradingCom,httpstcoppzXKvLwT Ethereum ETH price down today httpstcovJxIzBAAf
1633915276050743296,2023-03-09 19:38:53+00:00,https://twitter.com/cryptoalerted,httpstcolqYMzfOY YFDAI went percent the last minutes httpstcorgEAVgIXu YFDAI crypto bitcoin cryptocurrency btc ethereum blockchain eth trading altcoin binance cryptonews
1633913857008869376,2023-03-09 19:33:14+00:00,https://twitter.com/jollygreenmoney,SmallCap Hidden Gem Altcoin Layer Narrative Arbitrum Optimism KROM Kromatika the gateway the future Ethereum scaling gasless DEX that recently launched Arbitrum and about launch People are sleeping this project and heres why httpstcoZbsGlSSD
1633913680562888706,2023-03-09 19:32:32+00:00,https://twitter.com/niftyinvest,With only cap KROM the easiest future altcoin I’ve found date Gasless DEX for ethereum and the leading layer protocols xPolygon arbitrum optimismFND I’m expecting big things here for few reasons 👇👇👇 httpstcoCybDLif
1633913069955948544,2023-03-09 19:30:07+00:00,https://twitter.com/kriptoloji5534,piyasada düşüş modunu açık kalmış gibi herşey düşüyor Bitcoin Ethereum dxy altcoin altseason kriptopara Fed bear
1633912710990798852,2023-03-09 19:28:41+00:00,https://twitter.com/DoveHawkin,Only few altcoin showing strength like Ethereum Cardano against Bitcoin
1633910210166247435,2023-03-09 19:18:45+00:00,https://twitter.com/ParaticCom,Ethereumda Düşüş Devam Ediyor Boğalar Vazgeçti ETH ethereum altcoin BTC ETHUSD shanghai borsa hisse kriptopara bitci kriptopara kriptohaber kripto bearmarket httpstcoOGQgmCYBl
1633910190432047110,2023-03-09 19:18:40+00:00,https://twitter.com/Wong_insight,Why Ethereum ETH price down today Ethereum price down today and growing list macroeconomic challenges could continue weigh ETH price for the foreseeable future Bitcoin Altcoin httpstcoVgpBray
1633909381707251742,2023-03-09 19:15:27+00:00,https://twitter.com/blast29crypto,Prime Crypto Dealer Says One EthereumPrimarily based Altcoin Primed for Reversal Updates Outlook Bitcoin Story Found Here httpstcogcopHf cryptocurrency tokens
1633174533472505858,2023-03-07 18:35:26+00:00,https://twitter.com/Inv016,XAUUSD tested breakdown level and gave up⬇️⬇️ Bitcoin cryptocurrency BitcoinCash bitcoinmining bitcoinprice BitcoinNFTs Binance Ethereum ETHDenver GOOGL TSLA APPL NASDAQ SPX httpstcojZoEkzsMh
1634343195340414976,2023-03-10 23:59:17+00:00,https://twitter.com/fud_crown,Weekly RIP TERA Headed the dirt where belongs Anybody invested this since miltonterareum pulled that BinanceUS stunt deserve lose everything you got Terareum scam terascam teratrash bitcoin ethereum cryptocrash cryptocurrency httpstcoIRURTmX
1634343191217418244,2023-03-10 23:59:16+00:00,https://twitter.com/yashi0_8,Looking for the next big win crypto Alpha Trade the hunt for the next big SHIB and the profits may just get you Maclaren your own Bitcoin Ethereum BSC POLY FTM ETH ARB MATIC XRP🍸🥳
1634343180077355009,2023-03-10 23:59:13+00:00,https://twitter.com/yashthakrar1996,Current Price Bitcoin Litecoin dogecoin Ethereum EthereumClassic BitcoinCash
1634342643370012673,2023-03-10 23:57:05+00:00,https://twitter.com/zhanghu96,Crypto Bitcoin Ethereum Blog Polygon MATIC Layer httpstcoAkiZVdo httpstcovfBoRmxF
