tweet id,time of tweet,user id,text
1634342993812414464,2023-03-10 23:58:29+00:00,https://twitter.com/0xEthereumYoda,Ethereum price update ETH USD Bitcoin BTC Follow for recent ETH price updates altcoin cryptocurrency crypto
1634340702959071232,2023-03-10 23:49:22+00:00,https://twitter.com/0xEthereumYoda,Ethereum price update ETH USD Bitcoin BTC Follow for recent ETH price updates altcoin cryptocurrency crypto
1634339479069634560,2023-03-10 23:44:31+00:00,https://twitter.com/Wong_insight,Ethereum Shanghai upgrade could benefit liquid staking providers and cement ETH’s layer dominance Ethereum’s Shanghai upgrade set unlock trove staked Ether and possibly benefit other staking protocols that offer lucrative yields Bitcoin Altcoin httpstcoGUQDUNK
1634332549575999488,2023-03-10 23:16:58+00:00,https://twitter.com/0xEthereumYoda,Ethereum price update ETH USD Bitcoin BTC Follow for recent ETH price updates altcoin cryptocurrency crypto
1634328375778062337,2023-03-10 23:00:23+00:00,https://twitter.com/runbibot,ALERT BCH has entered Bullish territory crypto altcoin defi NFT Bitcoin Ethereum httpstcoPLhnxlreV
1634328121854836736,2023-03-10 22:59:23+00:00,https://twitter.com/bagtothefuture_,🔴What Web Why important httpstcoDmUbbdxxy ethereum blockchain cryptocurrency nft eth CryptoTwitter blockchain Web altcoin bitcoinprice bitcoin btc btc cardano ada sol cryptomarket viral cryptocurrency fypシ
1634323404764372992,2023-03-10 22:40:38+00:00,https://twitter.com/BNB_Tracker,BinanceCoin price update BNB BNB USD Bitcoin BTC Ethereum ETH altcoin crypto cryptocurrency Follow for recent BNB price updates
1634320414670458880,2023-03-10 22:28:45+00:00,https://twitter.com/DropTownSaloon,Ethereum ERC Set Boost NFT Space httpstcokhlXKWTT Crypto CryptoNews CryptoTrends NFT NFTNews NFTRelease NFTDrop AltCoin AirDrop NFTProject NFTArtist NFTCommunity CNFT CNFTCommunnity httpstcoEUUTmgzD
1634320335708336128,2023-03-10 22:28:26+00:00,https://twitter.com/0xEthereumYoda,Ethereum price update ETH USD Bitcoin BTC Follow for recent ETH price updates altcoin cryptocurrency crypto
1634317317218750466,2023-03-10 22:16:27+00:00,https://twitter.com/bagtothefuture_,🔴The Basics Web Beginners Guide the Future the Internet httpstcoHYUCHGPv ethereum blockchain cryptocurrency nft eth CryptoTwitter blockchain Web altcoin bitcoinprice bitcoin btc btc cardano ada sol cryptomarket viral cryptocurrency
1634317311283802114,2023-03-10 22:16:25+00:00,https://twitter.com/PayneGeordie4,Ethereum price update ETH USDBitcoin BTCFollow for recent ETH price updatesaltcoin cryptocurrency crypto
1634317153133264898,2023-03-10 22:15:48+00:00,https://twitter.com/KriptoSpace,milyar dolarlık piyasa değeriyle büyük ikinci stablecoin olan Circleın USDCsinin batan Silicon Valley Bankta rezervi bulunuyordu Miktarı akıbeti henüz açıklanmadı Bitcoin btc Ethereum eth Crypto altcoin
1634316963957620737,2023-03-10 22:15:03+00:00,https://twitter.com/PartyGuy6969,EverRise RISE EverRiseV EverRevoke DeFi Crypto Cryptocurrency Altcoin Ethereum Altcoins BinanceSmartChain Fantom Ethereum NFTCommunity NFTCommunity httpstcoVfKrdZyAy
1634316271205359618,2023-03-10 22:12:17+00:00,https://twitter.com/PlotRacerk,Dostlar bitcoin son düzeltmeni yapmış boğa formasyon düzeyine girmiş bunda sonra hedefimiz Bitcoin altcoin Ethereum
1634313206503030785,2023-03-10 22:00:07+00:00,https://twitter.com/TodaysCryptoCom,Crypto not scam crypto httpstcoBiDXlPmxV cryptocurrency bitcoin blockchain btc ethereum ico trading altcoin airdrop
1634303794111475713,2023-03-10 21:22:43+00:00,https://twitter.com/0xEthereumYoda,Ethereum price update ETH USD Bitcoin BTC Follow for recent ETH price updates altcoin cryptocurrency crypto
1634303133168852996,2023-03-10 21:20:05+00:00,https://twitter.com/wkimcnl,NEWS httpstcohYLkJGL crypto bitcoin cryptocurrency btc ethereum blockchain eth currency xrp trading price exchange ltc altcoin ico ripple altcoins binance market ada cardano mining cryptonews sol matic polygon shib doge
1634302638828183554,2023-03-10 21:18:07+00:00,https://twitter.com/Wong_insight,Ethereum Shanghai upgrade could benefit liquid staking providers and cement ETH’s layer dominance Ethereum’s Shanghai upgrade set unlock trove staked Ether and possibly benefit other staking protocols that offer lucrative yields Bitcoin Altcoin httpstcoSEfSlQbG
1634301857488093186,2023-03-10 21:15:01+00:00,https://twitter.com/Dinamikpiyasa,Kısa vade Gesan grafiğimiz Teknik olarak Fibonacci Direncine yükseliş bekliyorum Yön yukarı YTD Bist Borsa Bitcoin Dolar Enflasyon Hisse Eregl Tuprs Astor akbnk krdmd hekts altın altcoin thyao BorsaIstanbul Kontr NASDAQ Ethereum ekgyo Endeks Boğa httpstconUVnOSW
1634300110975963136,2023-03-10 21:08:04+00:00,https://twitter.com/DropTownSaloon,Ethereum Shanghai upgrade could benefit liquid staking providers and cement ETH’s layer dominance httpstcoYxlDcSa Crypto CryptoNews CryptoTrends NFT NFTNews NFTRelease NFTDrop AltCoin AirDrop NFTProject NFTArtist NFTCommunity CNFT CNFTCommunnity httpstcoIeGyQzjWkb
1634299242360582145,2023-03-10 21:04:37+00:00,https://twitter.com/Haskell_Gz,Fecha Pregunta por qué crear una Respuesta Ethereum altcoin dominante tiene serios problemas escalabilidad frustrante uso DeFi por sus altas fees voy pagar dólares fees una transacción dólares
1634299056204795906,2023-03-10 21:03:53+00:00,https://twitter.com/MaximilianShare,NOTIZIE CRYPTO Cointelegraph Italia Seguimi per News Crypto sempre aggiornate crypto bitcoin cryptocurrency blockchain btc ethereum trading altcoin criptovalute eth cryptotrading blockchain bitcoinprice cryptovalute httpstcoYNyUlhk
1634298138121981952,2023-03-10 21:00:14+00:00,https://twitter.com/runbibot,ALERT FTM has entered Bullish territory crypto altcoin defi NFT Bitcoin Ethereum httpstcoHkAuNvSVDu
1634298081943404547,2023-03-10 21:00:01+00:00,https://twitter.com/CoinCoinClan,DAILY MARKET RECAP total marketcap altcoin marketcap bitcoin dominance ethereum dominance total volume last DeFi volume last cryptotrading
1634296827880280064,2023-03-10 20:55:02+00:00,https://twitter.com/AltWonderland,Who the best Ethereum KILLER Cardano ADA Polygon MATIC Also best crypto buy ever luna ethereum polygon ada cryptoinvest httpstcoiJAXKNx httpstcoRDGTGd
1634291493195087879,2023-03-10 20:33:50+00:00,https://twitter.com/bagtothefuture_,🚨BREAKING Vitalik Buterin Dumps Altcoins Worth ETH httpstcoxMKQOvEQes ethereum investing blockchain cryptocurrency nft eth CryptoTwitter blockchain trading altcoin bitcoinprice bitcoin btc btc cardano ada sol cryptomarket viral cryptocurrency
1634290642208669698,2023-03-10 20:30:27+00:00,https://twitter.com/CryptoOnchain,Crypto Market today Bitcoin BTC ETH Ethereum altcoin altcoins cryptocurrency BNB Binance httpstcoMLGkZQdUg
1634290532485861382,2023-03-10 20:30:01+00:00,https://twitter.com/AltWonderland,Best Crypto Market buy Polkadot versus Kadena can Polkadot dry out the TVL from ETH amp BTC DOT KDA Kadena Ethereum crypto bitcoin cryptoinvest httpstcolMtOAphLQ httpstcoPlcTzgy
1634283572902375424,2023-03-10 20:02:21+00:00,https://twitter.com/24x7crypto,Service Token Theft Confirmed Hedera Mainnet Due Exploit httpstcoesfWljPRf altcoin business defi ethereum hacks smartcontracts uniswap
1634283459496538112,2023-03-10 20:01:54+00:00,https://twitter.com/bitcoincryptonl,Dure CryptoPunk NFT gekocht met waardeloze Ethereum testnet tokens Crypto Insiders httpstcoqgKEhko bitcoin crypto altcoin BTC ETH blockchain bitavo binance bitvavo cryptocurrency
1634283132307353600,2023-03-10 20:00:36+00:00,https://twitter.com/runbibot,ALERT INCH has entered Bullish territory crypto altcoin defi NFT Bitcoin Ethereum httpstcowgrzAvcx
1634283104104861704,2023-03-10 20:00:30+00:00,https://twitter.com/runbibot,ALERT ALPHA has entered Bullish territory crypto altcoin defi NFT Bitcoin Ethereum httpstcoWsYZCqAPzg
1634283069455712257,2023-03-10 20:00:21+00:00,https://twitter.com/runbibot,ALERT KSM has entered Bullish territory crypto altcoin defi NFT Bitcoin Ethereum httpstcolzmnGYB
1634281410126139414,2023-03-10 19:53:46+00:00,https://twitter.com/NoFomoNoCry,bitcoinin seviyesinden daha ucuz olduğu son gün MART yılın ardından yeni bir indirim gelir Martta tam düşmüştü Fomo olmayın Plan Yapın btc ethereum ethusdt altcoin kripto kriptopara buy sell long short spot futures scalp
1634279344695660549,2023-03-10 19:45:33+00:00,https://twitter.com/FAB_coin,Crypto the future cryptotrading cryptoworld cryptoart finance bitcoin ethereum blockchain blockchaintechnology fintech nft FABcoin Exchangily⁠ biswap HODL altcoin cryptocurrency eth cryptotrade digitalcurrency buybitcoin cryptoinvestor decentralized httpstcoQGGXiyC
1634277796640968704,2023-03-10 19:39:24+00:00,https://twitter.com/cryptoalerted,TAPME Token TAP went down percent the last minutes httpstcorgEAVgIXu TAP crypto bitcoin cryptocurrency btc ethereum blockchain eth trading altcoin binance cryptonews
1634275070129459209,2023-03-10 19:28:34+00:00,https://twitter.com/Lirrecc,ContractSurfers making their own crypto coin ❓‼️ You will able use for buying their subscriptions amp services the future ❓‼️🏄‍♂️ hodl bnb btc eth elonmusk bitcoin binance ethereum altcoin millionaire andrewtate rich money
1634274596403793920,2023-03-10 19:26:41+00:00,https://twitter.com/DavosCryptos,Complete Guide Making NFT Marketplace for Digital Collectibles Read more via httpstcocLzCUtjpd PlaytoEarn Crypto Nft Cryptocurrency Blockchain Altcoin Solana Ethereum
1634267950789062656,2023-03-10 19:00:17+00:00,https://twitter.com/TodaysCryptoCom,KUCOIN SUED ETHEREUM SECURITY httpstcooODtJpUdmX cryptowendyo KuCoin cryptocurrency bitcoin blockchain btc crypto ethereum ico trading altcoin airdrop
1634265593481244672,2023-03-10 18:50:55+00:00,https://twitter.com/0xEthereumYoda,Ethereum price update ETH USD Bitcoin BTC Follow for recent ETH price updates altcoin cryptocurrency crypto
1634265365139144705,2023-03-10 18:50:00+00:00,https://twitter.com/CryptoActuFr,Danger pour Ethereum cours l’ETH passe sous les dollars httpstcomIJwNFA bitcoin altcoin Cryptocurrency cryptomonnaie cryptonews blockchain LeJournalDuCoin
1634263789561323532,2023-03-10 18:43:45+00:00,https://twitter.com/NoFomoNoCry,yaklaşık sonra ABD Hazine Bütçesi verileri açıklanacak özellikle beklentiye uygunluğa göre volatilite yaratabilir daha fazlası için takip edin bitcoin btc ethereum ethusdt altcoin kripto kriptopara buy sell long short spot futures scalp fed httpstcosCsJncFFS
1634259567076052994,2023-03-10 18:26:58+00:00,https://twitter.com/SaltySe40612345,HOW ONBOARD THE WORLD httpstcoVnqXhGBF via YouTube TexanToken TEXAN HEX Pulsechain Ethereum Cryptocurrency ETH Bitcoin Altcoins BSC Hedron FreedomMaxi AltCoinSeason Crypto Blockchain SmartContracts DeFi Fintech CryptoInvesting Token Altcoin
1634256415052144650,2023-03-10 18:14:27+00:00,https://twitter.com/NoFomoNoCry,değerlendirenler için hem long hem short fırsatı oldu TAM KEZ fomo yapmadan kazanmak için takip edin telegrama katılın link bioda bitcoin btc ethereum ethusdt altcoin kripto kriptopara buy sell spot futures scalp httpstcolCnGpeLY
1634255253032804375,2023-03-10 18:09:49+00:00,https://twitter.com/BNB_Tracker,BinanceCoin price update BNB BNB USD Bitcoin BTC Ethereum ETH altcoin crypto cryptocurrency Follow for recent BNB price updates
1634255147738996736,2023-03-10 18:09:24+00:00,https://twitter.com/MaximilianShare,CRYPTO NEWS English from DECRYPT Follow for Fresh Crypto News crypto bitcoin cryptocurrency blockchain btc ethereum trading altcoin criptovalute eth cryptotrading blockchain bitcoinprice digitalmoney httpstcoCImEQgiTa
1634252856428470282,2023-03-10 18:00:18+00:00,https://twitter.com/runbibot,ALERT SUSHI has entered Bullish territory crypto altcoin defi NFT Bitcoin Ethereum httpstcokatIfHvU
1634252843359019011,2023-03-10 18:00:15+00:00,https://twitter.com/runbibot,ALERT STX has entered Bullish territory crypto altcoin defi NFT Bitcoin Ethereum httpstcoPCoGWtXrL
1634246069868720129,2023-03-10 17:33:20+00:00,https://twitter.com/CoinAquarium,Ethereum Currently Undervalued Santiment Crypto CryptoNews cryptocurrency Web DeFi NFTs NFTCommunity Bitcoin altcoin altcoins BTC ETH Metaverse httpstcoDOOteeVJC
1634245306601689088,2023-03-10 17:30:18+00:00,https://twitter.com/CoinDiaryApp,Arts DAO the Middle Easts premier Web brand amp largest community creators collectors and builders Click this link know more httpstcoouEbyTpG Follow CoinDiary for more updates dogecoin ripple binaryoptions altcoin investor hodl bitcoin ethereum btc httpstcoksPnfZ
1634244559071739904,2023-03-10 17:27:20+00:00,https://twitter.com/GlamourMaphanga,Three UndertheRadar EthereumBased Cryptos Among Altcoins Currently the Opportunity Zone Santiment Altcoin ethereum via httpstcoYyDBOa httpstcoyqcCmgA
1634244160893927474,2023-03-10 17:25:45+00:00,https://twitter.com/Lirrecc,ContractSurfers making their own coin ❓‼️ You will able use for buying their subscriptions amp services the future ❓‼️🏄‍♂️ hodl bnb btc eth elonmusk bitcoin binance ethereum altcoin millionaire andrewtate rich giveaway presale
1634242711262990336,2023-03-10 17:19:59+00:00,https://twitter.com/DropTownSaloon,Ethereum Price Prediction Bulls Hold Level Where ETH Heading Now httpstcoCdASdrnJC Crypto CryptoNews CryptoTrends NFT NFTNews NFTRelease NFTDrop AltCoin AirDrop NFTProject NFTArtist NFTCommunity CNFT CNFTCommunnity httpstcoJVEbjaZPy
1634242030720172051,2023-03-10 17:17:17+00:00,https://twitter.com/BNB_Tracker,BinanceCoin price update BNB BNB USD Bitcoin BTC Ethereum ETH altcoin crypto cryptocurrency Follow for recent BNB price updates
1634238587322417158,2023-03-10 17:03:36+00:00,https://twitter.com/bitcoincryptonl,ben fel tegen deze shitcoins zegt Ethereum oprichter Vitalik Buterin Crypto Insiders httpstcoUIzlopmWq bitcoin crypto altcoin BTC ETH blockchain bitavo binance bitvavo cryptocurrency
1634238570650116097,2023-03-10 17:03:32+00:00,https://twitter.com/bitcoincryptonl,Dure CryptoPunk NFT gekocht met ‘waardeloze’ Ethereum testnet tokens httpstcoSsxQJmbbV bitcoin crypto altcoin BTC ETH blockchain bitavo binance bitvavo cryptocurrency
1634238568326627329,2023-03-10 17:03:32+00:00,https://twitter.com/bitcoincryptonl,ben fel tegen deze shitcoins zegt Ethereum oprichter Vitalik Buterin httpstcotYycrxopmv bitcoin crypto altcoin BTC ETH blockchain bitavo binance bitvavo cryptocurrency
1634237739011850259,2023-03-10 17:00:14+00:00,https://twitter.com/runbibot,ALERT BNB has entered Bullish territory crypto altcoin defi NFT Bitcoin Ethereum httpstcocxuCOaA
1634237107320537088,2023-03-10 16:57:43+00:00,https://twitter.com/theprismreviews,What are the risks involved holding cryptocurrency exchange like Coinbase Gemini Binance for long periods time Investissement Fintech Trading Blockchain news binance altcoin exchange trading Ethereum cryptoexchange httpstcoTiGGOshH
1634237006879260672,2023-03-10 16:57:19+00:00,https://twitter.com/AlphaPool511,Make money with World Mobile Token crypto bitcoin cryptocurrency btc ethereum blockchain eth currency trading price exchange ltc altcoin altcoins Binance getcrypto rise mining cryptonews Cardano wmt alphapool httpstcoPVuDaUIOUi
1634236686778368000,2023-03-10 16:56:03+00:00,https://twitter.com/AlphaPool511,What are digital signatures crypto bitcoin cryptocurrency btc ethereum blockchain eth currency trading price exchange ltc altcoin altcoins Binance getcrypto rise mining cryptonews Cardano wmt alphapool httpstcolsLiIyUQ
1634236360289599493,2023-03-10 16:54:45+00:00,https://twitter.com/AlphaPool511,What are examples Smart Contract Programming Language crypto bitcoin cryptocurrency btc ethereum blockchain eth currency trading price exchange ltc altcoin altcoins Binance getcrypto rise mining cryptonews Cardano wmt alphapool httpstcobGjZrRgW
1634235946718642183,2023-03-10 16:53:06+00:00,https://twitter.com/AlphaPool511,Everything you need know about crypto lending crypto bitcoin cryptocurrency btc ethereum blockchain eth currency trading price exchange ltc altcoin altcoins Binance getcrypto rise mining cryptonews Cardano wmt alphapool httpstcohJrXkvs
1634230954960232448,2023-03-10 16:33:16+00:00,https://twitter.com/Phillip_X_,MononokeInu will continue break records and change many lives Mark words TeamMononokeA Mononoke MononokeInu altcoin memecoins ATH shiba FLOKI nextgem nex dogecoin ETH Ethereum cryptocurrencies cryptocurrency BTC dogecoin
1634230154846191618,2023-03-10 16:30:06+00:00,https://twitter.com/koinmedya_,Bitcoin kripto fiyatları neden düştü İşte önemli sebebi httpstcoExOfvkzC kriptopara koinmedya bitcoin ethereum btc eth bitcoinhaberleri ethereumhaberleri güncelhaber koinhaberleri kriptoparahaberleri altcoin bitcoin btc eth kriptopara
1634229953716981760,2023-03-10 16:29:18+00:00,https://twitter.com/CoinAquarium,Binance Dominates Crypto Spot Market CryptoNews cryptocurrency Web DeFi NFTs NFTCommunity Bitcoin Ethereum altcoin altcoins BTC ETH Metaverse BNB httpstcotcPitcu
1634228200275427328,2023-03-10 16:22:20+00:00,https://twitter.com/MyronHouse17,Ethereum price update ETH USDBitcoin BTCFollow for recent ETH price updatesaltcoin cryptocurrency crypto
1634226872929140737,2023-03-10 16:17:03+00:00,https://twitter.com/NFTrats,BREAKING Over million liquidated from the cryptocurrency market and whale activity surges altcoins according data from Coinspectator cryptocurrency bitcoin ethereum altcoin
1634226842491142144,2023-03-10 16:16:56+00:00,https://twitter.com/cryptowind0,Ethereum halen pahalı altcoin longlar için ether bekleyebiliriz kırdığı trendlere retest veriyor market httpstcoJHPGMtmt
1634226356723523586,2023-03-10 16:15:00+00:00,https://twitter.com/koinmedya_,Bitcoin kripto fiyatları neden düştü İşte httpstcoExOfvkzC kriptopara koinmedya bitcoin ethereum btc eth bitcoinhaberleri ethereumhaberleri güncelhaber koinhaberleri kriptoparahaberleri altcoin bitcoin btc eth kriptopara
1634225909606563847,2023-03-10 16:13:13+00:00,https://twitter.com/texan_token,“How Onboard the World” Join CryptoHartbeat live now httpstcoGDyMLhwRe TEXAN TexanToken Ethereum ETH PulseChain PLS PLSX altcoin DeFi
1634225584615112707,2023-03-10 16:11:56+00:00,https://twitter.com/ParaticCom,Bitcoin ABD Tarım Dışı İstihdam Verilerine Nasıl Tepki Verdi Bitcoin BTCUSD bitci BTC kripto borsa hisse Ethereum kriptopara crypto altcoin kriptohaber httpstcoKqZjkIxyk
1634224794504667137,2023-03-10 16:08:48+00:00,https://twitter.com/MaximilianShare,NOTIZIE CRYPTO httpstcoFvGnK crypto bitcoin cryptocurrency blockchain btc ethereum trading altcoin criptovalute eth cryptotrading blockchain bitcoinprice cryptovalute httpstcoyGoQmwnv
1634222668521127938,2023-03-10 16:00:21+00:00,https://twitter.com/runbibot,ALERT OCEAN has entered Bullish territory crypto altcoin defi NFT Bitcoin Ethereum httpstcogqqDxls
1634220957593382914,2023-03-10 15:53:33+00:00,https://twitter.com/CoinAquarium,Govt Digital Wallets Transfer BTC Glassnode Crypto CryptoNews cryptocurrency Web DeFi NFTs NFTCommunity Bitcoin Ethereum altcoin altcoins ETH Metaverse httpstcoBhMRtUftz
1634219656922669056,2023-03-10 15:48:23+00:00,https://twitter.com/NoFomoNoCry,paylaştık oldu daha fazlası için takip edin telegrama katılın link bioda bitcoin btc ethereum ethusdt altcoin kripto kriptopara buy sell long short spot futures scalp httpstcolYiwtln
1634218224450428929,2023-03-10 15:42:41+00:00,https://twitter.com/0xEthereumYoda,Ethereum price update ETH USD Bitcoin BTC Follow for recent ETH price updates altcoin cryptocurrency crypto
1634217570680315904,2023-03-10 15:40:05+00:00,https://twitter.com/TheDripStar,EthereumPrimarily based Gaming Challenge Rallies After Coinbase Pronounces Shock Altcoin Itemizing Cryptocurrency Sponsor httpstcomPhKtNCN httpstcoFvtyYagjK
1634217543148634112,2023-03-10 15:39:59+00:00,https://twitter.com/NoFomoNoCry,Yepyeni spekülasyonların kapısı açılacak demektir bitcoin btc ethereum ethusdt altcoin kripto kriptopara buy sell long short spot futures scalp
1634216072705634304,2023-03-10 15:34:08+00:00,https://twitter.com/DropTownSaloon,OpenSea Sees Explosive Demand for Vitalik NFT Collection Tied Ethereum CoFounder Heres What You Need Know httpstcoPSoVUicKa Crypto CryptoNews CryptoTrends NFT NFTNews NFTRelease NFTDrop AltCoin AirDrop NFTProject NFTArtist NFTCommunity httpstcoMHCRaKBJk
1634210914843893762,2023-03-10 15:13:38+00:00,https://twitter.com/KriptoSpace,Rusya Bitcoin kriptoda uluslararası ticarete Temmuz ayında izin verecek Kongre Finans Komitesi Başkanı BTC Ethereum ETH crypto altcoin
1634208790424825857,2023-03-10 15:05:12+00:00,https://twitter.com/ZacharyAtkins77,Solana SOLBased Altcoin Skyrockets After Earning Support From Top Crypto Exchange httpstcopmqkNk BNB Bitcoin Crypto Ethereum NFTs CryptoTwitter Blockchain Avax Litecoin TRX MemphianDollar NFT
1634208322206269440,2023-03-10 15:03:20+00:00,https://twitter.com/nyan_lou618,Three UndertheRadar EthereumBased Cryptos Among Altcoins Currently the Opportunity Zone Santiment Ethereum altcoin via httpstcohxRcnpBu httpstcofrSkSKId
1634206344033992707,2023-03-10 14:55:29+00:00,https://twitter.com/CoinAquarium,Regulator Warns Crypto Investors ProofofReserve” Reports CryptoNews cryptocurrency Web DeFi NFTs NFTCommunity Ethereum altcoin altcoins BTC ETH httpstcoowJNilZE
1634206190870618114,2023-03-10 14:54:52+00:00,https://twitter.com/Bitcoin4allFree,Buy BTC and all other Crypto now Get your altcoin with commission kickback after register Binance httpstcorQLtBNpQYI… AndOr for free after your first buy BTC Coinbase httpstcogsEynOqo Bitcoin Ethereum retweet ETH
1634206153772089344,2023-03-10 14:54:43+00:00,https://twitter.com/harbigulyabani,Btc yukarı yönlü hareketler bekliyorum pazar günü sürprizli gelebilir takipte kalalım kriptopara bitcoin kripto rkiye yat borsa btc bitcoint altcoin crypto cryptocurrency finans ethereum kriptohaber btcturk giri ekonomi kriptoparahaberleri btcturk httpstcoslITncWc
1634205124301316099,2023-03-10 14:50:38+00:00,https://twitter.com/CRYPT0411,Vitalik Buterin speaks against shitcoins despite recently selling them Through reddit post Vitalik expressed his stands some the shitcoins disposed off the past few days has pushes the… httpstcoQmVMFWxC Blockchain Altcoin Ethereum VitalikButerin httpstcoOMKDucJ
1634203867763347467,2023-03-10 14:45:38+00:00,https://twitter.com/BushOrangutan,Vitalik Buterin speaks against shitcoins despite recently selling them httpstcoxvjcUFEsQn Blockchain Altcoin Ethereum VitalikButerin
1634203136691957761,2023-03-10 14:42:44+00:00,https://twitter.com/DropTownSaloon,New York Attorney General Alleges Ethereum Tokens are Securities Lawsuit Against KuCoin Crypto Exchange Crypto Clampdown Incoming httpstcoLOspkOQn Crypto CryptoNews CryptoTrends NFT NFTNews NFTRelease NFTDrop AltCoin AirDrop NFTProject NFTArtis httpstcoyLDbYuYVg
1634200854109585413,2023-03-10 14:33:40+00:00,https://twitter.com/MaximilianShare,NOTIZIE CRYPTO Cryptonews Seguimi per News Crypto sempre aggiornate crypto bitcoin cryptocurrency blockchain btc ethereum trading altcoin criptovalute eth cryptotrading blockchain bitcoinprice cryptovalute httpstcoKrPyFBPMzJ
1634200816947961857,2023-03-10 14:33:31+00:00,https://twitter.com/Altcoin_Track,Bankrupt Exchange Voyager Liquidates Worth Ethereum SHIB and Other ERC Tokens March news emerged that bankrupt crypto exchange Voyager had liquidated million worth Ethereum httpstconfnBwtwFhB
1634200191380193280,2023-03-10 14:31:02+00:00,https://twitter.com/CardanoNewsFeed,CFTC claims Ethereum from the SEC httpstcooYWmYXXP cardano ADA lovelace bitcoin cardanocommunity adalovelace altcoin btc blockchain ADA cardanonewsfeed crypto httpstcorKXDjfynt
1634200026875592704,2023-03-10 14:30:23+00:00,https://twitter.com/CoinAquarium,SilvergateBank Closes Voluntarily Liquidating Assets Crypto CryptoNews cryptocurrency Web DeFi NFTs NFTCommunity Ethereum altcoin altcoins BTC ETH Metaverse httpstcooysIfZmNQ
1634199079524659203,2023-03-10 14:26:37+00:00,https://twitter.com/tokenkult,Imaginez juste instant pouvoir assister une des plus grosses opportunités dans les crypto L’important c’est savoir vous prendrez arrive… cryptomonnaie altcoin bitcoin btc eth ethereum httpstcomqIeBLeK
1634197101658931212,2023-03-10 14:18:45+00:00,https://twitter.com/DropTownSaloon,Next stop Shanghai Ethereum’s latest milestone approaches httpstcoKPvZUjFzIz Crypto CryptoNews CryptoTrends NFT NFTNews NFTRelease NFTDrop AltCoin AirDrop NFTProject NFTArtist NFTCommunity CNFT CNFTCommunnity httpstcoTJVMFarzn
1634197066460045315,2023-03-10 14:18:37+00:00,https://twitter.com/tokenkult,team crypto🌪 Bitcoin Dominance Indice peur BTC Hebdomadaire ETH cryptomonnaie altcoin investir bitcoin ethereum Cryptocurency httpstcoGAOyhm
1634196957953400837,2023-03-10 14:18:11+00:00,https://twitter.com/Wong_insight,Next stop Shanghai Ethereum’s latest milestone approaches The Ethereum ecosystem edging closer its latest milestone the Shanghai upgrade draws near Bitcoin Altcoin httpstcosDkZTXPUB
1634196772045160461,2023-03-10 14:17:27+00:00,https://twitter.com/Cryptoverse_Eu,Bitcoin Cryptonews Ethereum BTC Crypto Blockchain Cryptos That Suffered During Altcoin Market Collapse httpstcoqbUiIQbVT
1634196586912792576,2023-03-10 14:16:42+00:00,https://twitter.com/DAHLIA_Kece,Three UndertheRadar EthereumBased Cryptos Among Altcoins Currently the Opportunity Zone Santiment Altcoin ethereum via httpstcoMjFgBZhuHr httpstcopyJHgtAb
1634196551173013504,2023-03-10 14:16:34+00:00,https://twitter.com/Matematikci84,retestin vermiş olduğu güvenle dönüşü müthiş olacak buradan binler gelecek izliyorum gözlerim kapalı☺️ btc bitcoin eth ada altcoin BTCUSDT eos SHIB CEEK SOL AVAXUSDT AVAX MATIC chz mana gala DOGE total eth Ethereum binance BNB
