tweet id,time of tweet,user id,text
1634272419287384069,2023-03-10 19:18:02+00:00,https://twitter.com/Rags2RichesFAM,Appealing broad audience you guys already know this stuff TexanToken TEXAN Cardano Solana Ethereum Cryptocurrency Pulsechain ETH Bitcoin Altcoins BSC Hedron FreedomMaxi ASIC XRP NFTs AVAX AXIEINFINITY httpstcocsItWNiM
1634272224504061952,2023-03-10 19:17:16+00:00,https://twitter.com/fxigtrades,Trades closed good profit BTC Bitcoin NFT NFTs ETH Ethereum Crypto cryptocurrency investing NFTcommunity Forex Stocks trading pips nftart xrpsec Metaverse MetaverseNFT XRP SPX StockMarkets SongHyeKyo httpstcoHyJeSxtDTD
1634272109416382464,2023-03-10 19:16:48+00:00,https://twitter.com/YarenTepe3,Shibucoin relatively new cryptocurrency that was created memeinspired alternative Dogecoin Like Dogecoin Shibucoin based the Ethereum blockchain and uses decentralized peertopeer network enable transactions httpstcohazfVxQdH
1634271828993617921,2023-03-10 19:15:41+00:00,https://twitter.com/navidnassiri,NYAG Labels Ether Security KuCoin Lawsuit httpstcoPDvwPOabU crypto cryptocurrency blockchain bitcoin ethereum antifud fightfomo httpstcoXlSeudDv
1634271708575158279,2023-03-10 19:15:13+00:00,https://twitter.com/nuworldcrypto,senators write banking regulators about potential crypto discrimination Bitcoin Ethereum blockchain altcoins NFTCommunity cryptocurrency Congress cryptonews httpstconkkiWMQtD
1634271631093760000,2023-03-10 19:14:54+00:00,https://twitter.com/Cryptoweazels,Coinbase Acquires One River Digital Increase Institutional Entry Crypto httpstcorRuAPHVz bitcoin btc cryptocurrency blockchain money currency ethereum bitcoinprice market buybitcoin cash trading bitcoincash futures exchange bitcoinhas gold
1634271523535048709,2023-03-10 19:14:29+00:00,https://twitter.com/Crypto_magnews,What Polkadot Coin Exploring The Newest Cryptocurrency Bitcoin BTC Blockchain Ethereum ETH httpstconUXSDTBE
1634271087847456768,2023-03-10 19:12:45+00:00,https://twitter.com/crypdogot,Crypto taking over With the rise Bitcoin Ethereum and other cryptocurrencies its clear that the future money digital Are you ready join the revolution Cryptocurrency Decentralization Blockchain
1634270328435228672,2023-03-10 19:09:44+00:00,https://twitter.com/CryptoNewsMaker,Bitcoin CoinEditionPosition DisclaimerThe MoreoverEthereum CryptoNews FolloMe cryptocurrency Bearish Pattern Appears Ripple’s Price Amid Market Turmoil Position added successfully httpstcowmMguuw
1634269998020476931,2023-03-10 19:08:25+00:00,https://twitter.com/shizukagirlie,yourcryptodj RainmakerGaming free global gaming network that links players games and guilds all around the world advised buy their native token RAIN which currently declining and has lot potential cryptocurrency Ethereum GameFi
1634269867783380992,2023-03-10 19:07:54+00:00,https://twitter.com/Vandad041,Vandad found ethereum Illusion Weavers Green vault this location Join playing coinhuntworld Its awesome CHWxLasVegas CHWFEST httpstcoSDjasc cryptocurrency httpstcoGkkWMCEWHN
1634269367293693953,2023-03-10 19:05:55+00:00,https://twitter.com/Alexand89795222,BTC USDT WALLET ADDRESS FOR RECEIVING RETURNS Payment Method Bitcoin Usdt Ethereum Litecoin and other crypto currency now for your trading plan
1634268613791174663,2023-03-10 19:02:55+00:00,https://twitter.com/Cryptoc95295747,Hoe onze analisten daling van ethereum koers zagen aankomen httpstcoYcwhxFzOV Bitcoin Bitcoinnieuws Bitcoinnl cryptonieuws
1634268130703970304,2023-03-10 19:01:00+00:00,https://twitter.com/ElibadoLarry,kamoteQ found ethereum White vault this location Join playing coinhuntworld Its awesome httpstcoRvtJdFUvFp cryptocurrency httpstcoNxioqwohB
1634267954866016278,2023-03-10 19:00:18+00:00,https://twitter.com/cryptosenderio,Say goodbye the tedious task sending tokens one one Use httpstcoooaSXiTIv send ERC tokens multiple addresses once and enjoy the benefits its low fees and WalletConnect integration Cryptocurrency Ethereum httpstcoIRcJzPSB
1634267883625762826,2023-03-10 19:00:01+00:00,https://twitter.com/coinscopecrypto,What ahead for Bitcoin after this period transition🧐 The BTC markets have been undergoing intriguing change since midFebruary What expect crypto crypto bitcoin cryptocurrency blockchain ethereum btc trading money cryptonews httpstcoUQGibLyYIN
1634267748846145536,2023-03-10 18:59:29+00:00,https://twitter.com/shibJortiz707,NOWNodes Shares Roadmap for Shibarium Integration Ahead Launch shytoshiKusama ShibaArmy shibainu SHIB SHIB BONE LEASH TREAT Shibarium ETH Bitcoin shiba BTC Ethereum cryptocurrency crypto httpstcojFkSmQD
1634267568167952387,2023-03-10 18:58:46+00:00,https://twitter.com/BlackthornStem,Cardano another leading cryptocurrency that has gained traction recently due its smart contract platform and scalability capabilities compared other blockchains like Ethereum NEO httpstcopOiDcxQ Cardano ADA coti
1634267514233573376,2023-03-10 18:58:33+00:00,https://twitter.com/NCU_Today,Ethereum Price Prediction Bulls Hold Level Where ETH Heading Now httpstcocsXcgplM NFTMarketplace Crypto NFTs CryptoCurrency GameFi Blockchain BlockchainNews News Web NCUToday httpstcobMVfsmG
1634267449431412736,2023-03-10 18:58:17+00:00,https://twitter.com/tootiredtoshine,Sploopologist found ethereum User vault this location Join playing coinhuntworld Its awesome httpstcofELmhNOy cryptocurrency httpstcoPohxKrjcp
1634267115757633539,2023-03-10 18:56:58+00:00,https://twitter.com/tootiredtoshine,Sploopologist found ethereum Blue vault this location Join playing coinhuntworld Its awesome httpstcofELmhNOy cryptocurrency httpstcoryUjbnljB
1634265935707099170,2023-03-10 18:52:16+00:00,https://twitter.com/CannabisNFTMag,Welly Burger NFT Series httpstcoZWuCoc via abduzeedo nftcommunity eth blockchain ethereum crypto cryptocurrency
1634265448769376264,2023-03-10 18:50:20+00:00,https://twitter.com/SquawkCrypto,news Ethereum Tokens Index Crypto Strategy was just rebalanced Copy Crypto Strategy httpstcoFwfHTCubt cryptocurrency crypto ethereum defi httpstcoiAXaxiidR
1634265181344739329,2023-03-10 18:49:17+00:00,https://twitter.com/tootiredtoshine,Sploopologist found ethereum User vault this location Join playing coinhuntworld Its awesome httpstcofELmhNOy cryptocurrency httpstcoPDMzWtpyH
1634265162730426394,2023-03-10 18:49:12+00:00,https://twitter.com/Alexand89795222,BTC USDT WALLET ADDRESS FOR RECEIVING RETURNS Payment Method Bitcoin Usdt Ethereum Litecoin and other crypto currency now for your trading plan FTX
1634264819065823255,2023-03-10 18:47:50+00:00,https://twitter.com/tootiredtoshine,Sploopologist found ethereum User vault this location Join playing coinhuntworld Its awesome httpstcofELmhNOy cryptocurrency httpstcocGrlYzdYU
1634264494300864548,2023-03-10 18:46:33+00:00,https://twitter.com/tootiredtoshine,Sploopologist found ethereum User vault this location Join playing coinhuntworld Its awesome httpstcofELmhNOy cryptocurrency httpstcogwscsBwHs
1634264423928832020,2023-03-10 18:46:16+00:00,https://twitter.com/CurrencyNews,Blockchains and Bitcoin the financial frontier University North Carolina Greensboro httpstcobSMqziO CryptoNews ETH XRP BLockchain Ethereum QASH BitcoinNews Cryptocurrencynews BTC BlockchainNews BCH CryptoCurrency
1634264118801604631,2023-03-10 18:45:03+00:00,https://twitter.com/tootiredtoshine,Sploopologist found ethereum User vault this location Join playing coinhuntworld Its awesome httpstcofELmhNOy cryptocurrency httpstcobbTtaSWlF
1634263479237353504,2023-03-10 18:42:31+00:00,https://twitter.com/TechnologyElev1,More than billion was wiped off the crypto market hours bitcoin dropped below httpstcolIFLdZve cryptocurrency bitcion Ethereum SVB marketcrash httpstcopMvCQBxw
1634263250870349825,2023-03-10 18:41:36+00:00,https://twitter.com/cryptojohnsmith,ETHEREUM PRICE PREDICTION PRICE RISE⤴ min BUY ETH for apiece Binance Target price Amount Ethereum ETH prediction Binance httpstcoxnkjcvu
1634263157215485952,2023-03-10 18:41:14+00:00,https://twitter.com/Martin90588706,MATIC has completed wave Ill watching closely but expecting the price where buys are waiting Polygon Ethereum Bitcoin Elliottwave crypto cryptocurrency httpstcopflsAifAj
1634262874519670784,2023-03-10 18:40:07+00:00,https://twitter.com/TheDripStar,Ethereum Simply Plunged Its Lowest Degree opposition Bitcoin Since October Cryptocurrency Sponsor httpstcomPhKtNCN httpstcocZpRZuSBxw
1634262870140526604,2023-03-10 18:40:06+00:00,https://twitter.com/CryptoStarsPub,What ERC How Ethereum’s Upgrade Redefining NFTs and Inhibits Mass Web Adoption httpstcoQoxHstqR cryptos cryptocurrency NFTs web Metaverse
1634261727679225859,2023-03-10 18:35:33+00:00,https://twitter.com/Legitcryptonerd,The Bitcoin dip youre seeing right now will end being wick the monthly SHA ALLAH The smart money wants shake you out before the mega leg btc btc eth Ethereum eth xrp xrp link link cryptocurrency httpstcoHmGyiZtGa
1634261352372944897,2023-03-10 18:34:04+00:00,https://twitter.com/AnnaMac1234,Buying the Dip bitcoinmining bitcoin cryptocurrency crypto blockchain bitcoinnews bitcoins forex bitcointrading ethereum bitcoincash bitcoinprice money investment trading binaryoptions forextrader cryptocurrencies cryptotrading invest BusinessNews httpstconhTFDfgus
1634261208328175619,2023-03-10 18:33:29+00:00,https://twitter.com/cryptojohnsmith,ETHEREUM PREDICTION RESULT Deal Close ETH for Entry BUY Entry Price min ago Binance Amount Trade Profit Daily Monthly Ethereum ETH Binance httpstcolqkhYFNy httpstcoVMDtJAJr
1634260838075736078,2023-03-10 18:32:01+00:00,https://twitter.com/dusaki848,ABBY found ethereum Blue vault this location Join playing coinhuntworld Its awesome httpstcotoiRTumD cryptocurrency httpstcozbMOaaC
1634260484676263939,2023-03-10 18:30:37+00:00,https://twitter.com/solanatoshi,Investors are taking profit Ethereum ETH after the cryptocurrency reached alltime highs
1634259636197924870,2023-03-10 18:27:15+00:00,https://twitter.com/CryptoCState,Crypto community reacts NYAGs lawsuit Ethereum really security Neeraj Agrawal the Director Communications Coin Center disagreed with the New York Attorney General’s NYAG recent assessment Ethereum security httpstcoOYJxfYYRu
1634259172572434434,2023-03-10 18:25:24+00:00,https://twitter.com/hexapithw,There are several promising trends watch out for the world cryptocurrency The rise crypto casinos nfts and ethereum are some the latest trends Stay informed and prepared for the changes ahead cryptocurrency has been
1634259090108207105,2023-03-10 18:25:04+00:00,https://twitter.com/CryptoET2,Ethereum ETH Might Drop What Does OpenAI Got With instaethereum cryptocurrency ripplenews coinbase FreeCoin coldstorage proofofwork cardano httpstcowbuOjDfw
1634258666798084099,2023-03-10 18:23:23+00:00,https://twitter.com/btc_gallery,Ethereum Market coin Update March Follow btcgallery cryptocurrency httpstcoeWwwdrQW
1634257991951155202,2023-03-10 18:20:42+00:00,https://twitter.com/Rags2RichesFAM,Just quick reminder the vermin HEX haters that have receded into the dark recesses social media with this last HEX pump Ill happy publicly debate you reaction video your fact less HEX hit pieces Cheers Cardano Solana Ethereum Cryptocurrency… httpstcorPTBANxf
1634257835096936448,2023-03-10 18:20:05+00:00,https://twitter.com/Just_Trader_Joe,That being said when mutherfudders start calling for btc and eth its usually not bad time start slurping BTC ETH Bitcoin Ethereum BullMarket bearmarket Crypto cryptocrash market cryptocurrency bearish bullish slurp justtraderjoe
1634257787202203649,2023-03-10 18:19:54+00:00,https://twitter.com/HiTTrader_co,Ethereums price has dropped over the last hours trading The reason behind the decline price can partly attributed the recent crackdown cryptocurrency mining activities China But that the only reason httpstcotbQCFu httpstcoFBsVhQRrq
1634257647015698464,2023-03-10 18:19:20+00:00,https://twitter.com/Legitcryptonerd,Easy play Dot its btc pair This range keeps giving Rinse and repeat Bitcoin BTC ETH ETHEREUM eth Xrp Xrp link Dot Polkadot cryptocurrency crypto Qnt QNT httpstcoOlNJMa
1634257285475340288,2023-03-10 18:17:54+00:00,https://twitter.com/Raishiz1,Crypto News Silicon Valley Bank shut down California regulator httpstcoKwdEPDxCV BTC Bitcoin ETH Cryptocurrency cryptoupdate Crash Bullish Bearish Ethereum Binance BNB
1634256519179935757,2023-03-10 18:14:51+00:00,https://twitter.com/SA_Shares,Top Cryptocurrencies POPULARITY Bitcoin Ethereum BNB XRP Dogecoin crypto cryptocurrency Bitcoin Ethereum BNB XRP dogecoin CryptocurrencyNews cryptonews httpstcoXkyvCURzzE
1634256121119780864,2023-03-10 18:13:16+00:00,https://twitter.com/pbeebear,PBeeBear found ethereum User vault this location Join playing coinhuntworld Its awesome httpstcoEkpigFUcc cryptocurrency httpstcoYCiOSCnT
1634256108914348032,2023-03-10 18:13:14+00:00,https://twitter.com/bestcurrencyuk,Buy Ethereum Church End Ethereum Trading Sites Church End httpstcoRXOAgvJUq
1634254633840566272,2023-03-10 18:07:22+00:00,https://twitter.com/theharristheory,Why Ethereum ETH price down today httpstcoUpuMSENPDg crypto cryptocurrency cryptonews
1634254397688381442,2023-03-10 18:06:26+00:00,https://twitter.com/TelephoneKiosk,Telefunky found ethereum User vault this location Join playing coinhuntworld Its awesome httpstcolSOOmpnk cryptocurrency httpstcoapMTJFuUsR
1634254113243373570,2023-03-10 18:05:18+00:00,https://twitter.com/navidnassiri,Shiba Inu Ablaze With Burn Rate Will This Fire SHIB Price httpstcooeDDIin crypto cryptocurrency blockchain bitcoin ethereum antifud fightfomo
1634253733155467264,2023-03-10 18:03:47+00:00,https://twitter.com/Blocktunix,With the world moving towards blockchain technology get your blockchain solution developed with the blockchain expert Blocktunix blockchain blocktunix smartcontracts dapps cryptocurrency ethereum solidity hyperledger consensus tokenization decentralization httpstcoTpFZGB
1634253672925241367,2023-03-10 18:03:33+00:00,https://twitter.com/ZhotCrypto,“Raise The Debt Ceiling ELSE” httpstcooWnrcgJp Congressional Hearing today Jerome Powell testifies Congress Live Let’s discuss the latest cryptocurrency news for bitcoin ethereum altcoins amp MORE SLAP THE LIKE BUTTON Use code ‘ALTCOINDAILY’ for
1634253616058884096,2023-03-10 18:03:19+00:00,https://twitter.com/Sealsthegains,Avoid FOMO fear missing out and FUD fear uncertainty and doubt Stay levelheaded Crypto StockMarket BTC Ethereum cryptocurrency
1634253483242037270,2023-03-10 18:02:48+00:00,https://twitter.com/_444th,I’d hate see this but need the liquidity httpstcoeMRCLLfEA Ethereum NFT cryptocurrency Crypto httpstcoojEzdNEW
1634253370717249541,2023-03-10 18:02:21+00:00,https://twitter.com/greekmythclub,🔱Greek God Hit the you love this Greek God NFT NFTs NonFungibleTokens Blockchain CryptoArt CryptoCollectibles DigitalArt DigitalCollectibles Crypto Cryptocurrency CryptoInvesting Ethereum Bitcoin DeFi Altcoins CryptoNews Trading ICO httpstcoKhcyemfPhS
1634253190140137472,2023-03-10 18:01:38+00:00,https://twitter.com/politicsdemon,Crypto for the win Ethereum Bitcoin Crypto cryptocurrency
1634252983947894809,2023-03-10 18:00:48+00:00,https://twitter.com/desota,Crypto prices bitcoin solana ethereum tether binance coin cardano USD coin ripple dogecoin polkadot shiba inu httpstcoZKGPCvEDl BTC BTC ETH BNB DOGE XRP cryptocurrencies cryptocurrency cryptotrading httpstcoHZKdIVNqm
1634252785410781188,2023-03-10 18:00:01+00:00,https://twitter.com/ripetvofficial,Effective Investment Strategies for Navigating Bear Market Cryptocurrency Bitcoin Ethereum Dogecoin httpstcoVLMKHPikL
1634252034248417289,2023-03-10 17:57:02+00:00,https://twitter.com/AppleCryptox,taxes and the value the dollar increase the cost Apple products also rising But dont worry our project offers Bitcoin payment method that allows you purchase Apple products lower price bitcoin cryptocurrency ethereum Web httpstcoUwstykd httpstcoGZzNiHalFc
1634251392473866241,2023-03-10 17:54:29+00:00,https://twitter.com/navidnassiri,DOJ Appeals New York Judge’s Decision Approve Voyager’s Sale httpstcoMaHaDmaYI httpstcoFmoORcgOd crypto cryptocurrency blockchain bitcoin ethereum antifud fightfomo httpstcoBVVUoiQZ
1634250506980798467,2023-03-10 17:50:58+00:00,https://twitter.com/gec_swiss,GEC Geneva Event Crypto premier grand évènement public français sur monde blockchain Genève httpstcoPSTQMK gecswiss blockchain bitcoin cryptocurrency crypto ethereum btc eth NFT cryptonews mining trading technology DeFif
1634250480216944640,2023-03-10 17:50:52+00:00,https://twitter.com/MilkyGemHunter,Does anyone know any Crypto projects hiring full stack devsengineers the moment Ive got number candidates whove reached out recently cryptocurrency blockchaintechnology Layer Layer GameFi Metaverse NFT DeFi ethereumblockchain Polygon ALGO…
1634250353905479681,2023-03-10 17:50:21+00:00,https://twitter.com/AltwolfCrypto,CELR long too OCEAN OCEANUSDT Ripple Shibarium Altcoins Bitcoin Cryptocurrency Altcoins HODL Blockchain DeFi NFT Bitcoin Ethereum BTC XRP AVAX SOL BNB ADA DOT httpstcoPGedADnMW
1634250295856463872,2023-03-10 17:50:08+00:00,https://twitter.com/RonaldR86315885,There are several promising trends watch out for the world cryptocurrency The rise crypto casinos nfts and ethereum are some the latest trends Stay informed and prepared for the changes ahead cryptocurrency has been
1634250115471888385,2023-03-10 17:49:25+00:00,https://twitter.com/navidnassiri,Algorand ALGO and Tron TRX nosedive while Orbeon Protocol ORBN emerges with far more potential than major coins httpstcoBPvJzwmRF crypto cryptocurrency blockchain bitcoin ethereum antifud fightfomo
1634249510128853000,2023-03-10 17:47:00+00:00,https://twitter.com/ElbowBrius,ElbowBrius found ethereum Blue vault this location Join playing coinhuntworld Its awesome httpstcovAGxHRVjZ cryptocurrency httpstcoDgiThNGTx
1634247985872752642,2023-03-10 17:40:57+00:00,https://twitter.com/AltwolfCrypto,REN Good time buy REN RENUSDT Ripple Shibarium Altcoins Bitcoin Cryptocurrency Altcoins HODL Blockchain DeFi NFT Bitcoin Ethereum BTC XRP AVAX SOL BNB ADA DOT httpstcobGyvBu
1634247777709334547,2023-03-10 17:40:07+00:00,https://twitter.com/nuworldcrypto,Crypto Market Cap Drops Below Trillion Bitcoin Altcoins Deep Red This Week’s Recap cryptonews crypto blockchain Bitcoin Ethereum NFTs NFT cryptocurrency altcoins httpstcoRHCFsqH
1634247319418707982,2023-03-10 17:38:18+00:00,https://twitter.com/MoodyAmigos,This Mushy here check who not engaging with this post NFT NFTCommmunity nftart NFTCollection NFTMarketplace digitalart DigitalArtist digitalcollectibles ETH Ethereum Crypto nonfungibletokens cryptocurrency opensea httpstcowZlBeVMl
1634247226963664897,2023-03-10 17:37:56+00:00,https://twitter.com/beeforenews,Breaking News Rating Coin Ticker CRV Price changed within minutes crypto bitcoin blockchain ethereum cryptocurrency CRV DELAYED MINUTES Download our FREE APP bio notified REAL TIME httpstcoEyvjRxcgKr
1634246790365995010,2023-03-10 17:36:12+00:00,https://twitter.com/CryptoNDaily,Ethereum CoFounder Vitalik Buterins Address Sells Trillions Airdropped Tokens Causes Illiquid Coin Prices Plummet Bitcoin News rCryptoCurrency httpstcoLJoJqWxZ httpstcoQUPpb
1634246223749062669,2023-03-10 17:33:57+00:00,https://twitter.com/0xJayson09,VulcanBlockchain Will Worldwide Available Soon VUL KiwiToken WavemStudios FunQuestArcade THENFTFARMER pokerboyeth VulcanChain 🏆🏆🏆🏆 vulcan crypto bitcoin cryptocurrency blockchain ethereum btc money CryptoNews cryptotrading bitcoinmining… httpstcocabfdNA
1634245878700720130,2023-03-10 17:32:34+00:00,https://twitter.com/cryptojohnsmith,ETHEREUM PRICE PREDICTION PRICE RISE⤴ min BUY ETH for apiece Binance Target price Amount Ethereum ETH prediction Binance httpstcopaLOCyJJ
1634245690854350866,2023-03-10 17:31:50+00:00,https://twitter.com/HyipsOtc,Kassoft trading Platform Earn daily YouTube withdraw httpstcoZDxLsNwlV Register link httpstcofXVAtJVQMr cryptocurrency Crypto CryptocurrencyMarket trc ERC Ethereum ETH xrp ltc Litecoin Tether trx tron passiveincome NFT defi httpstcopqsuLEhuY
1634245586227728384,2023-03-10 17:31:25+00:00,https://twitter.com/greenghostnft,Strong support amp Ethereum ETH Crypto cryptocurrency trading httpstcosxrLWCwT
1634245535409250320,2023-03-10 17:31:13+00:00,https://twitter.com/DefiOverview,UPDATE cryptocurrency price 📌March Bitcoin ethereum binance xrp cardano Polygon blockchain Crypto httpstcoGApLZO
1634245237311950848,2023-03-10 17:30:02+00:00,https://twitter.com/DigitalMoneyBo1,OpenSea Sees Explosive Demand for Vitalik NFT Collection Tied Ethereum CoFounder Heres What httpstcoRdvsaAmCfl CryptocurrencyNews cryptocurrency Crypto CryptoNews nft
1634245229644488727,2023-03-10 17:30:00+00:00,https://twitter.com/ledotclub1,New addition the collection opensea dots amp life httpstcoDMDiOHVZ cryptoart digitalart nftart cryptoartist crypto nft cryptocurrency ethereum cryptocollectors cryptonft cryptoinvesting OpenSeaNFT AIart httpstcoaYMtdPsKCC
1634244114173812738,2023-03-10 17:25:34+00:00,https://twitter.com/cryptojohnsmith,ETHEREUM PREDICTION RESULT Deal Close ETH for Entry BUY Entry Price min ago Binance Amount Trade Profit Daily Monthly Ethereum ETH Binance httpstcotoRHCAulS httpstcoIIrpmtmZY
1634244110075740190,2023-03-10 17:25:33+00:00,https://twitter.com/MH__crypto,httpstcoeZcXUPv تحديث بتكوين على الاطار اليومي احتمالية الهبوط اكثر الى المنطقة المحددة لتطمل الموجة بعدها موجة احتمالية ارتداد الى المناطق المشار اليها اليوت Crypto cryptocurrency البتكوين Elliott Ethereum btc والتوفيق للجميع
1634243609649360896,2023-03-10 17:23:33+00:00,https://twitter.com/CRYPT0411,Markets Causing Chaos for Bitcoin Ethereum BNB and XRP Holders HedgeUp HDUP Could Investors Savior From the recent developments and advancements cryptocurrency its obvious that the crypto market gearing experience shift in… httpstcozxaYjDoA httpstcofikbWgKcg
1634243587553542163,2023-03-10 17:23:28+00:00,https://twitter.com/cryptonewsbytes,HederaHBAR confirms that the mainnet breach resulted the theft millions service tokens httpstcoXrXlyGiBR cryptonewsbytes cryptocurrency crypto cryptonewsbytes bitcoin ethereum eth btc hbar swirldslabs security HBARfoundation LimeChainHQ Pang httpstcoVwxkqNuUf
1634242782742339585,2023-03-10 17:20:16+00:00,https://twitter.com/NCU_Today,New York Attorney General Alleges Ethereum Tokens are Securities Lawsuit Against KuCoin Crypto Exchange Crypto Clampdown Incoming httpstcoEbdTyhvLm NFTMarketplace Crypto NFTs CryptoCurrency GameFi Blockchain BlockchainNews News Web NCUToday httpstcoQJaovKbi
1634242762986930180,2023-03-10 17:20:12+00:00,https://twitter.com/KogerDaizy,There are several promising trends watch out for the world cryptocurrency The rise crypto casinos nfts and ethereum are some the latest trends Stay informed and prepared for the changes ahead cryptocurrency has been
1634242749963857921,2023-03-10 17:20:09+00:00,https://twitter.com/CryptoSmartlife,Starbucks Odyssey Releases ‘The Siren Collection’ Its First LimitedEdition NFT Drop crypto bitcoin cryptocurrency blockchain ethereum btc forex trading money cryptonews cryptotrading bitcoinmining cryptocurrencies investing eth investment bitcoinnews
1634242741113872385,2023-03-10 17:20:06+00:00,https://twitter.com/TheDripStar,Tether Launches Tokens Pegged the Mexican Peso Ethereum Tron and Polygon Altcoins Bitcoin Information Cryptocurrency Sponsor httpstcomPhKtNCN httpstcoOMwwbOAw
1634242461554884634,2023-03-10 17:19:00+00:00,https://twitter.com/Choosingcrypto,Periods price decline cryptocurrency can stressful and hard navigate for experienced traders and beginning investors alike But remember that each market dip has far been followed recovery and significant growth Ethereum Bitcoin
1634242425085411333,2023-03-10 17:18:51+00:00,https://twitter.com/AppleCryptox,Due taxes and dollars Apple products are getting expensive The future coming Through our project you can buy Apple products cheaply with Bitcoin payment method bitcoin cryptocurrency ethereum bitcoinmining binance apple appleproducts Web httpstcoUwstykd httpstcoEvMsileKe
1634242414838726677,2023-03-10 17:18:49+00:00,https://twitter.com/VeteranOwned1,Metas new decentralized social app set rival Twitter Will cryptocurrency integration follow and rescue crypto market httpstcopKyjNrlSoW The fight for Web supremacy has led the significant adoption Bitcoin Ethereum and other digital assets httpstcozlNXhRD
1634242179567632384,2023-03-10 17:17:53+00:00,https://twitter.com/sunmanpatu,CoinBoost found ethereum Blue vault this location Join playing coinhuntworld Its awesome httpstcoglbZXlnVKG cryptocurrency httpstconLMD
1634241709373571092,2023-03-10 17:16:00+00:00,https://twitter.com/Rufprentercy,RuffyP found ethereum Green vault Amakara Sushi Join playing coinhuntworld httpstcoOpOIMzOr cryptocurrency httpstcoLyNWmutL
1634241598128046089,2023-03-10 17:15:34+00:00,https://twitter.com/AltwolfCrypto,OCEAN long this holding EMA Golden ratio OCEAN OCEANUSDT Ripple Shibarium Altcoins Bitcoin Cryptocurrency Altcoins HODL Blockchain DeFi NFT Bitcoin Ethereum BTC XRP AVAX SOL BNB ADA DOT httpstcoolZZhip
1634241502493720578,2023-03-10 17:15:11+00:00,https://twitter.com/AppleCryptox,Due taxes and dollars Apple products are getting expensive The future coming Through our project you can buy Apple products cheaply with Bitcoin payment method bitcoin cryptocurrency ethereum bitcoinmining binance apple appleproducts Web httpstcoUwstykd httpstcowRbigRlR
1634241430410412051,2023-03-10 17:14:54+00:00,https://twitter.com/bitnewsbot,New York Attorney General Sues KuCoin Argues Ethereum and Other Cryptocurrencies are Securities httpstcoEyvlMHoly btcnews cryptocurrency crypto cryptonews btc eth
