tweet id,time of tweet,user id,text
1634323797217255424,2023-03-10 22:42:12+00:00,https://twitter.com/NFTNewsInsider,Bitcoin and Crypto Liquidated Just Hours Powerful Law Enforcement Agency Targets Ethereum httpstcocfrsKekTF
1634323295989542912,2023-03-10 22:40:12+00:00,https://twitter.com/Syndica_io,Lastly the NYAG points single line EFs website claim that met the prong Howey expectation profits from the efforts others the Ethereum Foundation notes its website that many ETH users see investment similar Bitcoin httpstcosFdmFcty
1634323281150091265,2023-03-10 22:40:09+00:00,https://twitter.com/TheDripStar,Traders Could Anticipate Draw back For Bitcoin And Ethereum Market For The Subsequent Months Cryptocurrency Sponsor httpstcomPhKtNCN httpstcoUjclHifG
1634322910742724609,2023-03-10 22:38:40+00:00,https://twitter.com/Worldpak2,OpenSea Sees Explosive Demand for Vitalik NFT Collection Tied Ethereum CoFounder Heres What You Need Know httpstcoNWXswXhbM Bitcoin btc httpstcozmTysjEcMn
1634322650167123968,2023-03-10 22:37:38+00:00,https://twitter.com/cryptovivek,SEC denies VanEck spot BTC trust product commissioners see double standard Crypto Bitcoin Ethereum
1634322371875155971,2023-03-10 22:36:32+00:00,https://twitter.com/JaydenLevitt,you’re into Bitcoin…swap into Ethereum and buy NFTs When Bitcoin goes does Ethereum your NFT assets stay the same but eth goes it’s win win Some playing chess out here NFA
1634321910447128576,2023-03-10 22:34:42+00:00,https://twitter.com/Cryptoverse_Eu,Bitcoin Cryptonews Ethereum BTC Crypto Blockchain Binance Brings its Prepaid Crypto Card Colombia httpstcoYNNZqz
1634321824766107648,2023-03-10 22:34:21+00:00,https://twitter.com/RomeoGillespie3,Crypto traders suffered staggering million liquidations over the past hours Binance traders saw the biggest loss million out all the exchanges Bitcoin btcusd led the way million followed ethereum eth
1634321428261527552,2023-03-10 22:32:47+00:00,https://twitter.com/navidnassiri,Crypto Regulation Overhaul Plans Gaining Traction Republican House httpstcoOrYbofIeW crypto cryptocurrency blockchain bitcoin ethereum antifud fightfomo
1634320966686760961,2023-03-10 22:30:57+00:00,https://twitter.com/crypto_stimulus,BTC ETH ADA BNB DOGE LINK TRX XRP bitcoin doge cardano ethereum bnb
1634320729281028097,2023-03-10 22:30:00+00:00,https://twitter.com/CenarioCrypto,🔴Messi investe blockchain Link completo vídeo httpstcoSwOuutWt Bitcoin BTC cripto Criptomonedas Ethereum ETH blockchain blockchains httpstcoXUTtDiVzI
1634320728756572163,2023-03-10 22:30:00+00:00,https://twitter.com/TokenHex,Pulsechain Testnet Coming Along Wonderfully Richard Heart Excited pulsechain crypto BTC ETH RichardHeart Ethereum hex PulseChain plsx DeFi NFT Bitcoin stocks Watch LIVE mins httpstcolKIkdsjzL
1634320468919369729,2023-03-10 22:28:58+00:00,https://twitter.com/_williamsod,OpenBetAI Bet coins You can bet using the following ERC tokens Bitcoin Ethereum USDT EVM Smart chain USDC Polygon httpstcoDMUMKjHel
1634320378083377152,2023-03-10 22:28:36+00:00,https://twitter.com/enadorange,Bitcoin Ethereum When the dust settles Here’s peek what you will see Hex overnight success But true its purest form Not going away And when Pulse launches Well that’s called crypto history Pay attention please httpstcoVZixqnVH
1634320358965760002,2023-03-10 22:28:32+00:00,https://twitter.com/BybitDerivatv,want try something fun Sell USDCSDT When ill say close the trade Recommended leverage crypto Btc Bitcoin Ethereum
1634320333170720775,2023-03-10 22:28:26+00:00,https://twitter.com/Kalydzakari,Thats where sei comes game changer sei TTF currentlytest net the fastest finality compared popular chains like Bitcoinethereumsolanaaptos and binance smart chain
1634320124193767432,2023-03-10 22:27:36+00:00,https://twitter.com/LazyTrainsUK,Drop your NFT wanna support some you Follow retweet and like this post👇 eth ethereum crypto NFT NFTs nftart nftartists sol shib bitcoin
1634320117751324674,2023-03-10 22:27:34+00:00,https://twitter.com/btcnewsapp,Bitcoin and Crypto Liquidated Just Hours Powerful Law Enforcement Agency Targets Ethereum The Daily Hodl via BTCnews for iOS httpstcoymPiL
1634319395563491328,2023-03-10 22:24:42+00:00,https://twitter.com/vicconsult,Crypto Whale Transfer Alert BTC were transferred from GEMINI unknown address bcquqmutxkgxmjfdrayjzdadldmrhhl 🚀🚀🚀 For more details httpstcoazMVhmHQG crypto Bitcoin ETH HODL Ethereum
1634319376009646081,2023-03-10 22:24:38+00:00,https://twitter.com/Cryptoverse_Eu,Bitcoin Cryptonews Ethereum BTC Crypto Blockchain Crypto Analyst Says Bitcoin DoorDie Situation Warns Crash Vital BTC Support Level Crumbles httpstcoQxeUYEA
1634318980625121282,2023-03-10 22:23:03+00:00,https://twitter.com/WorldOfGoonz,BREAKING Bitcoin over again Bitcoin CryptoCommunity Ethereum Polygon NFTsales httpstcouHAOZAtn
1634318723665506304,2023-03-10 22:22:02+00:00,https://twitter.com/Raishiz1,Crypto News Binance Bans Russians From Transactions With Dollars and Euros Exchanges Bitcoin News httpstcoLzYtUGwya BTC Bitcoin ETH Cryptocurrency cryptoupdate Crash Bullish Bearish Ethereum Binance BNB
1634318491305082881,2023-03-10 22:21:07+00:00,https://twitter.com/_williamsod,OpenBetAI Bet coins You can bet using the following ERC tokens Bitcoin Ethereum USDT EVM Smart chain USDC Polygon httpstcoBdIvPSj
1634318471612841985,2023-03-10 22:21:02+00:00,https://twitter.com/andresvilarino,Apps amp Platforms for Anonymous CryptocurrencySwapping Blockchain Crypto Cryptocurrency DigitalCurrency DigitalCoins cryptonews Bitcoin BTC Ethereum ETH httpstcoQEGcQr httpstcotsLbOArfc
1634318294789373954,2023-03-10 22:20:20+00:00,https://twitter.com/cryptonewsbytes,Missed Opportunity South Dakota Governors Veto Cryptocurrency Bill Deals Blow Innovation and Progress httpstcoxdLJWZQjbO crypto cryptonewsbytes bitcoin ethereum eth btc southdakota veto binance sec httpstcoUahJboLx
1634318281321349121,2023-03-10 22:20:17+00:00,https://twitter.com/zzinovvv,Bitcoin and Crypto Liquidated Just Hours Powerful Law Enforcement Agency Targets Ethereum httpstcozNoZBtZy
1634317514178961409,2023-03-10 22:17:14+00:00,https://twitter.com/KaifRaj77902996,Cathy Wood Bitcoin Ethereum sur bonne voie malgré l’effondrement plusieurs sociétés cryptographie httpstcoAIwgxYCchZ
1634317494620942336,2023-03-10 22:17:09+00:00,https://twitter.com/GoinvestIT,Bitcoin Ethereum Differenze analogie Guida httpstcotWZDaXf
1634317388551188481,2023-03-10 22:16:44+00:00,https://twitter.com/Lord_Ashdrake,Bitcoin will always here and maybe ethereum you cant wrong with holding BTC just withdraw bank account your local currency
1634317312890138625,2023-03-10 22:16:26+00:00,https://twitter.com/Shillmachine,以這個價格出售資產的人注定要失敗。 你必須做相反的事情，當它上漲時你會賣掉它，你會在這裡買它。 GALA GALA GoGalaGames Bitcoin Metaverse DeFi NFT WEB Ethereum SAND MANA GRT FET TSLA ElonMusk APT bitbank
1634317200751296516,2023-03-10 22:15:59+00:00,https://twitter.com/Cryptoverse_Eu,Bitcoin Cryptonews Ethereum BTC Crypto Blockchain PancakeSwap TVL Drops Did This Exchange Received Lethal Blow httpstcoiIKnzuXbyp
1634316982081159168,2023-03-10 22:15:07+00:00,https://twitter.com/Temose11,you know you can make daily weekly and monthly while trading cryptocurrency like Bitcoin Ethereum Litecoin etc with the aid legitimate crypto trader
1634316448872157185,2023-03-10 22:13:00+00:00,https://twitter.com/abit_HEX,Whats the mission HEX and how did achieve just years RichardHeart created the best product crypto Cant wait see what PulseChain will Crypto Cryptocurrency Bitcoin Blockchain ETH Ethereum XRP CryptoTrading CryptoNews httpstcogkTXVMBY
1634316309591732226,2023-03-10 22:12:26+00:00,https://twitter.com/RealCryptoFeet,Slowly then suddenly we’re getting the bottom the range Don’t fade the shorts Bitcoin Ethereum stockmarketcrash matic feet trading
1634315815683014659,2023-03-10 22:10:29+00:00,https://twitter.com/Trademankripto,Hafta sonu itibari ile Borsa İstanbul kapandı İncelenmesini istediğiniz coinleri aşağıya bekliyorum👇👇👇 crypto NFT Giveaway Bitcoin BTC ETH BNB blockchain Ethereum cryptocurrency usdt NFTs
1634315801573625856,2023-03-10 22:10:25+00:00,https://twitter.com/Frost_Chemistry,MatrixAINetwork Yeah With maximum TPS Matrix Mainnet much faster than both Bitcoin and Ethereum the hopes scoring some free MAN Ive signed for the MEXC Kickstarter event From perspective MAN really promising venture
1634315640113864704,2023-03-10 22:09:47+00:00,https://twitter.com/Frost_Chemistry,Romose MAN represents solid endeavor Matrix Mainnets maximum throughput TPS far faster than that Bitcoin and Ethereum taking part the MEXC Kickstarter event the hopes securing some free MAN
1634315505229254658,2023-03-10 22:09:15+00:00,https://twitter.com/Frost_Chemistry,ItzUwem MatrixAINetwork perspective MAN really promising venture compared Bitcoin and Ethereum Matrix Mainnets maximum throughput TPS much faster For shot winning some free MAN taking part the MEXC Kickstarter event
1634315473985888256,2023-03-10 22:09:07+00:00,https://twitter.com/KaziHridoyAkas1,Which these will happen first🚀 BABYDOGE FLOKI Bitcoin Ethereum BNB Solana Chainlink Polkadot Matic Cardano XRP Dogecoin Vechain CRO Shib community DOD KaziHridoyAkas httpstcoFCYcQWSUE
1634315351490961409,2023-03-10 22:08:38+00:00,https://twitter.com/Whalepipe,Can someone explain What Dogecoin trying became ponzocoin that destroyed its investor Btcs level has returned prices whale scam that cant move cant even react The trust has sadly abandoned dogecoin Bitcoin btc Ethereum binance fed
1634315022041075713,2023-03-10 22:07:20+00:00,https://twitter.com/cryptoclickio,Ethereum Bearish scenario play reached❓ Check the post httpstcojfGQnSPh bitcoin tradingview crypto btc btc
1634314484096327681,2023-03-10 22:05:11+00:00,https://twitter.com/CryptoWithZee,Latest price updates for ETH amp BTC Bitcoin Ethereum
1634314473681870849,2023-03-10 22:05:09+00:00,https://twitter.com/ZacharyAtkins77,Blockchain Beyond Currency How Cardano and TRON are Pioneering Digital Identity httpstcoYFouwnSSA BNB Bitcoin Crypto Ethereum NFTs CryptoTwitter Blockchain Avax Litecoin TRX MemphianDollar NFT
1634314351376240640,2023-03-10 22:04:40+00:00,https://twitter.com/SpartanKrypto,bitcoin amp ethereum are both currently sale btc eth
1634314266441310208,2023-03-10 22:04:19+00:00,https://twitter.com/sophykinz,Bitcoin Ethereum and KNDM are banks KNDM KNDM XGem KingdomERC joeyhickson Gigawolf
1634314055904002050,2023-03-10 22:03:29+00:00,https://twitter.com/yashthakrar1996,Current Price Bitcoin Litecoin dogecoin Ethereum EthereumClassic BitcoinCash
1634314036996198400,2023-03-10 22:03:25+00:00,https://twitter.com/GeorgeMihalac12,httpstcorrqbKBSo hive crypto bitcoin Ethereum
1634324745758945288,2023-03-10 22:45:58+00:00,https://twitter.com/AlexTheBull666,MadSonsio CoinDesk skesslr cheyenneligon How much eth Lubin has Who are the descuised Wales the Ethereum ICO and how much they hold Decentralised What joke ETHGATE
1634305641069068288,2023-03-10 21:30:03+00:00,https://twitter.com/socialsupermgr,What Are the Top NFT blockchains httpstcoWkblSKNZ via coindesk NFTs NFTArts ordinals Bitcoin BAYC EthereumNFT EthereumNFTs cryptopunks BlurAirdrop Solana SolanaNFTs SolanaNFT SolanaGiveaways Polygon PolygonNFT MagicEden opensea OpenSeaNFT FLOW NFL httpstcogIeSdfKazV
1634299401341480964,2023-03-10 21:05:15+00:00,https://twitter.com/AurelieCoudouel,Selon procureur général New York lEther monnaie réseau Ethereum est titre financier httpstcovnERLXXL via coindesk
1634257261454561280,2023-03-10 18:17:48+00:00,https://twitter.com/CryptoG92,CoinDesk ethereum VitalikButerin sold the shitcoins and kept some those that thinks have potential still has moonbag cult
1634241441479180308,2023-03-10 17:14:57+00:00,https://twitter.com/DefiOverview,🔔UPDATE​ Crypto​ and​ DeFi​ news 🔊Ethereum​ foundation​ makes​ new​ Goerli​ Shapella announcement​ CryptoSlate 📉OnChain​ Liquidation​s​ Beckon as​ Ether​ slump​s​ to​ month​ low​ CoinDesk 🕵️‍♂️DeFi​ Protocol​ httpstcotZznSKLwsV hacker​ return​ CoinDesk
1634236195428286467,2023-03-10 16:54:06+00:00,https://twitter.com/BeenABoutCrypto,The NEWS doesn’t report all Ethereum CNN crypto CoinDesk Cointelegraph coinbureau SquawkCNBC CNBC ETH
1634224119884443649,2023-03-10 16:06:07+00:00,https://twitter.com/DamionC59834263,freddyriz CoinDesk skesslr cheyenneligon Now you see why they tried dismiss your case And backdoor trick ethereum illegal tactics… GaryGensler such turtle
1634221640866488321,2023-03-10 15:56:16+00:00,https://twitter.com/CurrencyNews,Bitcoin Bounces Modestly Adds Jobs February CoinDesk httpstcoUjshymQDS BTC CryptoCurrency Ethereum XRP ETH CryptoNews BLockchain Cryptocurrencynews BitcoinNews BlockchainNews QASH BCH
1634205287266635779,2023-03-10 14:51:17+00:00,https://twitter.com/MadSons_io,CoinDesk skesslr cheyenneligon Hmmm Ethereum security Interesting could have some massive implications especially for blockchainbased projects those relying decentralization What you think
1634199588587315202,2023-03-10 14:28:38+00:00,https://twitter.com/CoinDeskBrasil,Ethereum apontado como valor mobiliário ação movida por autoridades nos EUA httpstcoRLtRmKwpQw
1634195219829628928,2023-03-10 14:11:16+00:00,https://twitter.com/CurrencyNews,Bitcoin Bounces Adds Jobs February Beating Expectations CoinDesk httpstcoEELDWsimHQ BLockchain Ethereum BlockchainNews ETH XRP CryptoNews QASH BTC Cryptocurrencynews BitcoinNews BCH CryptoCurrency
1634148137630593024,2023-03-10 11:04:11+00:00,https://twitter.com/DeepFunds,CoinDesk ethereum VitalikButerin Lmao are judging ethics now are Just how ethical ETH
1634147863495073793,2023-03-10 11:03:06+00:00,https://twitter.com/dazcrypto,CoinDesk ethereum VitalikButerin Did same with Shib hmm cultural moral value
1634133911994261505,2023-03-10 10:07:40+00:00,https://twitter.com/Harrold_Denier,CoinDesk xPolygon Immutable ethereum polygon literally outperformed all these chains MILES wtf this chart
1634132816936984576,2023-03-10 10:03:18+00:00,https://twitter.com/JembaBTC,matdontmatter CoinDesk xPolygon Immutable ethereum literally the whole proof that
1634131543588237315,2023-03-10 09:58:15+00:00,https://twitter.com/koinly,coinbase CoinDesk krakenfx TheBlock FTX presentation shows ‘massive shortfall’ firm’s assets FTXOfficial and FTX have announced massive shortfall billion across wallets with the largest deficits Bitcoin Ethereum and Solana Source Cointelegraph httpstcoCSNZjJejb
1634128613346885632,2023-03-10 09:46:36+00:00,https://twitter.com/mmcken1,CoinDesk ethereum VitalikButerin Looks like market manipulation from him
1634127615551315968,2023-03-10 09:42:38+00:00,https://twitter.com/mat_dont_matter,CoinDesk xPolygon Immutable ethereum MATIC has long history performing well despite market conditions
1634123874462834691,2023-03-10 09:27:46+00:00,https://twitter.com/defidecentraliz,DeFi Protocol Maverick Unveils UniSwap Rival Decentralized Exchange Ethereum CoinDesk httpstcoMgMlTmN
1634109864409432065,2023-03-10 08:32:06+00:00,https://twitter.com/GibbonsLill,This wonderful read Regens and degens unite web ethereum via CoinDesk httpstcoUXGFjTVlKz
1634101947400683521,2023-03-10 08:00:39+00:00,https://twitter.com/SammySa84607411,CoinDesk ethereum VitalikButerin Why didnt refused airdropped then
1634097064383488003,2023-03-10 07:41:14+00:00,https://twitter.com/chaconconsultor,Brraking What Happens Ether Security httpstcoXhZMpzLe via coindesk Ethereum CryptoNews
1634095854339645445,2023-03-10 07:36:26+00:00,https://twitter.com/XRPLARGE,CoinDesk skesslr cheyenneligon now lets see how Ethereum doing from now and
1634089183919710209,2023-03-10 07:09:56+00:00,https://twitter.com/Balooish,CoinDesk OGshib ethereum VitalikButerin Dump the shit Bull run route
1634082536581390337,2023-03-10 06:43:31+00:00,https://twitter.com/DanielK42537934,CoinDesk ethereum VitalikButerin Russian spy
1634082044534767617,2023-03-10 06:41:33+00:00,https://twitter.com/schiopu94,CoinDesk ethereum VitalikButerin Buterin sold them buy buter with chees this time told cultural moral value you think like that why not just burn them all how moral sell others LOL
1634079237543202816,2023-03-10 06:30:24+00:00,https://twitter.com/RyoshiLife,jeffweier CoinDesk ethereum VitalikButerin Exactly guess have him and the ridiculous gas fees thank for finding EGLD vibrant ecosystem that’s constantly growing and evolving with crazy cheap gas fees transact blockchain
1634075820556689408,2023-03-10 06:16:49+00:00,https://twitter.com/BTCBearSlayer,CoinDesk ethereum VitalikButerin The first successful Alien pic from the UFO encounters They look strange but somewhat similar humans
1634070607846420480,2023-03-10 05:56:07+00:00,https://twitter.com/whiterabbitbyte,btcMasterPlan CoinDesk ethereum VitalikButerin Scammers Vitalik
1634069653214355458,2023-03-10 05:52:19+00:00,https://twitter.com/8oxToken,jeffweier CoinDesk ethereum VitalikButerin ETH agoMaybe Now see mother chain that hosts valuable projects built upon
1634066180519481345,2023-03-10 05:38:31+00:00,https://twitter.com/LolaCoinOrg,First Mover Asia Bitcoin Plunges MidJanuary Levels ALSO CoinDesk analyst Glenn Williams writes that regardless crypto’s recent complications httpstcozXPsPhugh altcoins Bitcoin Coindeskcom Crypto Cryptocurrency Ethereum Gaming NFT httpstcoomrKuuABkK
1634057001251553281,2023-03-10 05:02:03+00:00,https://twitter.com/crypto_futurama,CoinDesk ethereum VitalikButerin When bought they har moral value🤣
1634043622164418563,2023-03-10 04:08:53+00:00,https://twitter.com/Christianoserg2,CoinDesk ethereum VitalikButerin This guy just wanna survive the rest money crypto going die soon
1634038526785499137,2023-03-10 03:48:38+00:00,https://twitter.com/Nitro_Pancho,CoinDesk ethereum VitalikButerin Send some value way😂
1634030270050344960,2023-03-10 03:15:49+00:00,https://twitter.com/432XRP,Ethereum officially security lawsuit against KuCoin the New York Attorney General could have major consequences for investors ether and other proofofstake cryptocurrencies skesslr cheyenneligon explain httpstcoxMRcQTyJJ via coindesk
1634020686569127936,2023-03-10 02:37:44+00:00,https://twitter.com/SargeComfy,CoinDesk ethereum VitalikButerin what absolute clown just found out still packed the money tho
1634006900437073920,2023-03-10 01:42:58+00:00,https://twitter.com/ZechsMarquie,CoinDesk ethereum VitalikButerin Nothing like recession finally flush out the rats
1634003369634447361,2023-03-10 01:28:56+00:00,https://twitter.com/tranaiht,CoinDesk ethereum VitalikButerin donate via Gitcoin project donated will airdrop some for him Thats why got that token That normal Love vitalik
1634003325707223044,2023-03-10 01:28:45+00:00,https://twitter.com/Wallstreetrehab,The end crypto BTC bitcoin ETH ethereum ftx gemini Long GLD NEM JPM JPMorgan Cutting Ties With Crypto Exchange Gemini Source httpstcodtTnUztCK via coindesk
1634000698852405248,2023-03-10 01:18:19+00:00,https://twitter.com/coinrem,Crypto Traders Suffer Over Losses Liquidations Amid Market Crash CoinDesk Learn more httpstcoNAAyIBHGh Follow Coinrem Crypto Escrow Coinrem Crypto Bitcoin Ethereum Binance Dogecoin Elonmusk Cryptocurrency
1634000526944743426,2023-03-10 01:17:38+00:00,https://twitter.com/PavelNosok,New York Attorney General sues Kucoin claims Ethereum securities complaint coindesk JAPAN Coindesk Japan httpstcoWxaNvxAx
1633995416290177024,2023-03-10 00:57:20+00:00,https://twitter.com/SaitamaFella,CoinDesk ethereum VitalikButerin Altcoins You mean HITcoins
1633993601049927680,2023-03-10 00:50:07+00:00,https://twitter.com/JGrimaldo3,CoinDesk skesslr cheyenneligon guessing coinbase krakenfx and the rest the exchanges need delist Ethereum Luna and the rest the securities mean they did with XRP immediately This space picks and chooses fake decentralized space
1633992767805489153,2023-03-10 00:46:48+00:00,https://twitter.com/QlogoEth,Ethereum Developers Target March Date for Shanghai Upgrade Goerli Testnet httpstcoGzoNVccuVZ via coindesk
1633990069941071873,2023-03-10 00:36:05+00:00,https://twitter.com/XRPtheorist,CoinDesk ethereum VitalikButerin Evading government regulations moral Vitalik Bribery moral Vitalik
1633987962927972356,2023-03-10 00:27:43+00:00,https://twitter.com/jasonH21124,CoinDesk skesslr cheyenneligon Ethereum was great network was being used for medical records and banking etc and mining helped secure the network even more now theres mining secure the network whats gonna happen later when the network get comprised because this decision the dev team
1633987591635648514,2023-03-10 00:26:14+00:00,https://twitter.com/CurrencyNews,Coinglass CoinDesk httpstcoHVySWvZJ CryptoCurrency XRP BlockchainNews BCH BTC BLockchain Cryptocurrencynews BitcoinNews QASH Ethereum CryptoNews ETH
1633975885907873792,2023-03-09 23:39:43+00:00,https://twitter.com/CoinDesk,Ethereum officially security lawsuit against KuCoin the New York Attorney General could have major consequences for investors ether and other proofofstake cryptocurrenciesskesslr cheyenneligon explain httpstcoxMnyiCDwkr
1633972987236958209,2023-03-09 23:28:12+00:00,https://twitter.com/CraigAl51746507,CoinDesk ethereum VitalikButerin Why did buy them then the case that the tokens have been airdropped his wallet
1633970199547326464,2023-03-09 23:17:07+00:00,https://twitter.com/Crypto_Gu_Ru,CoinDesk ethereum VitalikButerin knew before 🤷🏻‍♂️
1633966326707265537,2023-03-09 23:01:44+00:00,https://twitter.com/DystopianRevolt,CoinDesk ethereum VitalikButerin Not even years old yet and already losing lots hair
1633965743128584192,2023-03-09 22:59:25+00:00,https://twitter.com/Duncan30414908,jeffweier CoinDesk ethereum VitalikButerin does dump its secret
1633965407190097923,2023-03-09 22:58:05+00:00,https://twitter.com/Duncan30414908,CoinDesk ethereum VitalikButerin likes making excuses
1633964333095956480,2023-03-09 22:53:49+00:00,https://twitter.com/mcw1599,CoinDesk ethereum VitalikButerin Why this being converted ETH Just say the dollar amount ETH makes sense here
1633962203530371072,2023-03-09 22:45:21+00:00,https://twitter.com/DeityPhysiology,CoinDesk ethereum VitalikButerin Cant use them for anything
1633955355842711552,2023-03-09 22:18:08+00:00,https://twitter.com/coinrem,Federal Reserve Setting New Squad Crypto Specialists CoinDesk Learn more httpstcoXpxUGSvS Follow Coinrem Crypto Escrow Coinrem Crypto Bitcoin Ethereum Binance Dogecoin Elonmusk Cryptocurrency
1633950381267877888,2023-03-09 21:58:22+00:00,https://twitter.com/CToshi_Bull,CoinDesk ethereum VitalikButerin This jeet VitalikButerin AKA Jeetioshi
1633943086374977537,2023-03-09 21:29:23+00:00,https://twitter.com/CryptoMarketSpy,CoinDesk ethereum VitalikButerin httpstcocbSjxqBiJc
1633936063516270594,2023-03-09 21:01:29+00:00,https://twitter.com/iAMSAM2022,CoinDesk ethereum VitalikButerin Lol VitalikButerin has cultural moral value called AMERICANS feeble minded doesn’t surprise that people love this guy People once upon time bought Yeezys He’s New York degree weather hot trash
1633934050300772356,2023-03-09 20:53:29+00:00,https://twitter.com/Samillion115,CoinDesk ethereum VitalikButerin Dumped BITE then opened and shut reddit sub group for BITEhe did that with SHIB too aaaaand know what happened there
1633931463178481664,2023-03-09 20:43:12+00:00,https://twitter.com/JosueMiguel7714,CoinDesk ethereum VitalikButerin
1633929586462392320,2023-03-09 20:35:45+00:00,https://twitter.com/ribeiroo_la,jeffweier CoinDesk ethereum VitalikButerin Disproven tornadocash
1633926728669069313,2023-03-09 20:24:23+00:00,https://twitter.com/futur_is_crypto,CoinDesk ethereum VitalikButerin kept cult token
1633922980156768263,2023-03-09 20:09:29+00:00,https://twitter.com/mbreezyy25,CoinDesk ethereum VitalikButerin This isnt even what said lol
1633920909798166528,2023-03-09 20:01:16+00:00,https://twitter.com/cool_dharan,CoinDesk ethereum VitalikButerin has sold Eth and would sell Ethereum🤣 What can assume from this🙃
1633917886946332677,2023-03-09 19:49:15+00:00,https://twitter.com/frogfren22,CatfishFishy CoinDesk ethereum VitalikButerin Fuck every single crypto
1633917754506919939,2023-03-09 19:48:44+00:00,https://twitter.com/frogfren22,CatfishFishy CoinDesk ethereum VitalikButerin This tweet timeline but not mentions lol
1633916820955578368,2023-03-09 19:45:01+00:00,https://twitter.com/CatfishFishy,CoinDesk ethereum VitalikButerin frogfren These tokens have your name all over them
1633915446712999938,2023-03-09 19:39:33+00:00,https://twitter.com/CoinDeskES,VitalikButerin fundador ethereum vendió ETH altcoins esta semana movimiento que explicó diciendo que los tokens tenían valor cultural moral Por oknightcrypto httpstcoFvzZvDEqD
1633914527031996417,2023-03-09 19:35:54+00:00,https://twitter.com/SirMatthewRoss,CoinDesk ethereum VitalikButerin Support BITE and stick Jeetalik Buterin
1633913487591358464,2023-03-09 19:31:46+00:00,https://twitter.com/helicondarkstar,CoinDesk ethereum VitalikButerin ETH the biggest shitcoin scam network there ever was
1633910863013789697,2023-03-09 19:21:20+00:00,https://twitter.com/Ghostbanned7,CoinDesk xPolygon Immutable ethereum Polygon MATIC insecure You crypto disservice giving any publicity other than derision
1633907529926230056,2023-03-09 19:08:06+00:00,https://twitter.com/FrancescoTradi2,Exciting news for the Ethereum community The Shanghai hard fork its way and promises significant improvements the network Check out this CoinDesk article learn more about what and why matters cryptocurrency blockchain httpstcoIbRFlQN
1633907421306339359,2023-03-09 19:07:40+00:00,https://twitter.com/dissfomo,CoinDesk ethereum VitalikButerin 换链换链。
1633905614135934996,2023-03-09 19:00:29+00:00,https://twitter.com/RiyoRichard,CoinDesk ethereum VitalikButerin Time move onto something new
